image_url1,image_url2,product_name,contact,price,MOQ
https://s.alicdn.com/@sc04/kf/H164d144ff7c24ab68930f089a335ba19r.jpg,https://img.alicdn.com/imgextra/i2/3028865584/O1CN01IwkAMF1r7WfFrFpTJ_!!3028865584.jpg,"High Quality Accessories Lanyard, Crossbody Phone Lanyard Logo Tether Tab Patch Adjustable Wrist Strap/",/contact us by Wechatname:Sunny22345,$0.70-1.00,Min. order: 300 pieces LanyardMin. order: 300 pieces
https://s.alicdn.com/@sc04/kf/H6ec921ef76694b8bb589d609249fdce7K.jpg,https://img.alicdn.com/imgextra/i2/3028865584/O1CN01IwkAMF1r7WfFrFpTJ_!!3028865584.jpg,Creative Braided Lanyard Keychain Anti-Lost Knot Rope Strap Polyester Nylon Fashionable DIY Accessories Women Phone Case Car Key,/contact us by Wechatname:Sunny22345,$0.30-0.45,Min. order: 10 pieces LanyardMin. order: 10 pieces
https://s.alicdn.com/@sc04/kf/H888c03daa19f4940bf8d0d866c1a5746o.jpg,https://img.alicdn.com/imgextra/i2/3028865584/O1CN01IwkAMF1r7WfFrFpTJ_!!3028865584.jpg,High Quality Polyester Custom Printed Sublimation Personalized Lanyard With Your Logo For Sale,/contact us by Wechatname:Sunny22345,$0.12-0.48,Min. order: 100 pieces LanyardMin. order: 100 pieces
https://s.alicdn.com/@sc04/kf/Ha990522907cd45859a22b719ba0340f54.jpg,https://img.alicdn.com/imgextra/i2/3028865584/O1CN01IwkAMF1r7WfFrFpTJ_!!3028865584.jpg,US MLB Baseball Club Thermal Transfer Gradient Long Lanyard Wholesale Mobile Work Pass Keychain Metal Buckle Lanyard,/contact us by Wechatname:Sunny22345,$0.55-0.65,Min. order: 10 pieces LanyardMin. order: 10 pieces
https://s.alicdn.com/@sc04/kf/Hc9faba6b5c7a40009aec640646aa38d3y.jpg,https://img.alicdn.com/imgextra/i2/3028865584/O1CN01IwkAMF1r7WfFrFpTJ_!!3028865584.jpg,High Quality Polyester Lanyards Customized Sublimation Polyester Lanyards Neck Straps,/contact us by Wechatname:Sunny22345,$0.08-0.45,Min. order: 2 pieces LanyardsMin. order: 2 pieces
https://s.alicdn.com/@sc04/kf/H83285d9487a549bf8c583e6e790bb4e4e.jpg,https://img.alicdn.com/imgextra/i2/3028865584/O1CN01IwkAMF1r7WfFrFpTJ_!!3028865584.jpg,Personalized Cheap Neck Printed Lanyard Wholesale High Quality Custom Polyester Lanyard With Logo Printing For Advertising,/contact us by Wechatname:Sunny22345,$0.22-0.25,Min. order: 100 pieces LanyardMin. order: 100 pieces
https://s.alicdn.com/@sc04/kf/Hebf9d381e9464f29a52ce3026fff9618m.png,https://img.alicdn.com/imgextra/i2/3028865584/O1CN01IwkAMF1r7WfFrFpTJ_!!3028865584.jpg,30 National Basketball Teams Logo American Sports Detachable Neck Lanyards Keychain,/contact us by Wechatname:Sunny22345,$0.42-0.52,Min. order: 300 pieces LanyardsMin. order: 300 pieces
https://s.alicdn.com/@sc04/kf/H85f1b186dbbb48888a1c955fa80ec535a.jpg,https://img.alicdn.com/imgextra/i2/3028865584/O1CN01IwkAMF1r7WfFrFpTJ_!!3028865584.jpg,Advertising Cotton Lanyard,/contact us by Wechatname:Sunny22345,$0.15-0.50,Min. order: 100 pieces LanyardMin. order: 100 pieces
https://s.alicdn.com/@sc04/kf/H8f766c3c9c864b739a30f4f5c1cf1350o.jpg,https://img.alicdn.com/imgextra/i2/3028865584/O1CN01IwkAMF1r7WfFrFpTJ_!!3028865584.jpg,Factory Good Price Designer Polyester Wrist Lanyard Keychain Custom Short Lanyards Wrist Strap Hand Phone Lanyards,/contact us by Wechatname:Sunny22345,$0.09-0.49,Min. order: 100 pieces LanyardMin. order: 100 pieces
https://s.alicdn.com/@sc04/kf/H3c7ab0ec59714738ab02865edd60190dd.png,https://img.alicdn.com/imgextra/i2/3028865584/O1CN01IwkAMF1r7WfFrFpTJ_!!3028865584.jpg,Personalized lanyard Polyester Neck Lanyard Silk Screen printing Sublimation Printed Cheap Custom Design lanyards,/contact us by Wechatname:Sunny22345,$0.10,Min. order: 1 piece lanyardMin. order: 1 piece
https://s.alicdn.com/@sc04/kf/H36a08c7cf1ce47789b6a5aedc228bb61L.jpg,https://img.alicdn.com/imgextra/i2/3028865584/O1CN01IwkAMF1r7WfFrFpTJ_!!3028865584.jpg,Wholesale personalized lanyard Polyester Neck Lanyard Silk Screen printing Custom Design lanyards,/contact us by Wechatname:Sunny22345,$0.10-0.28,Min. order: 500 pieces lanyardMin. order: 500 pieces
https://s.alicdn.com/@sc04/kf/H4e33f4b7c85e45f48be0ef013885de6dh.jpg,https://img.alicdn.com/imgextra/i2/3028865584/O1CN01IwkAMF1r7WfFrFpTJ_!!3028865584.jpg,High Quality Custom Printing Logo Polyester Lanyards For Mobile Phone Custom Lanyards lanyards with logo custom,/contact us by Wechatname:Sunny22345,$0.20-0.30,Min. order: 100 pieces LanyardsMin. order: 100 pieces
https://s.alicdn.com/@sc04/kf/Hd4f7f5403eee47f7933c9771b0096bedy.jpg,https://img.alicdn.com/imgextra/i2/3028865584/O1CN01IwkAMF1r7WfFrFpTJ_!!3028865584.jpg,High Quality Fashion Cotton Polyester Lanyard Keychain Short Phone Wrist Lanyard Rope,/contact us by Wechatname:Sunny22345,$0.29-0.55,Min. order: 500 pieces LanyardMin. order: 500 pieces
https://s.alicdn.com/@sc04/kf/Hd4214d69adfe4ca09db48b1673a2321eM.jpg,https://img.alicdn.com/imgextra/i2/3028865584/O1CN01IwkAMF1r7WfFrFpTJ_!!3028865584.jpg,High Quality Cheap Custom Lanyard Multi Color Print Logo Nylon Polyester Promotional Lanyards,/contact us by Wechatname:Sunny22345,$0.20-0.40,Min. order: 100 pieces LanyardMin. order: 100 pieces
https://s.alicdn.com/@sc04/kf/H899f21796e564122bd1b42c0992ecaf8Z.jpg,https://img.alicdn.com/imgextra/i2/3028865584/O1CN01IwkAMF1r7WfFrFpTJ_!!3028865584.jpg,Lanyard Manufacturer Cheap Personalized Neck Strap Polyester Printing Custom Lanyards With Logo Custom,/contact us by Wechatname:Sunny22345,$0.19-0.30,Min. order: 100 pieces LanyardMin. order: 100 pieces
https://s.alicdn.com/@sc04/kf/H8a8ac70729224c9e9daa7340461fc69bX.jpg,https://img.alicdn.com/imgextra/i2/3028865584/O1CN01IwkAMF1r7WfFrFpTJ_!!3028865584.jpg,Custom Sublimation Printed Nylon Lanyard Office Teacher Polyester Satin Lanyard with ID Card Badge Holder,/contact us by Wechatname:Sunny22345,$0.19-0.39,Min. order: 500 pieces LanyardMin. order: 500 pieces
https://s.alicdn.com/@sc04/kf/H688bf5aa9d164ca3bf7ed1ea3eda064eU.png,https://img.alicdn.com/imgextra/i2/3028865584/O1CN01IwkAMF1r7WfFrFpTJ_!!3028865584.jpg,Polyester Silk Screen Printing Lanyard With Safety Breakaway Pink Lanyards Logo Id Badge Holder Pink Lanyard Keychain,/contact us by Wechatname:Sunny22345,$0.32-0.60,Min. order: 30 pieces LanyardMin. order: 30 pieces
https://s.alicdn.com/@sc04/kf/H62b668f59a8c4ee3aa44d78a30197144M.jpg,https://img.alicdn.com/imgextra/i2/3028865584/O1CN01IwkAMF1r7WfFrFpTJ_!!3028865584.jpg,Customize Logo Polyester Lanyard Breakaway Neck Lanyard With Id Card Holder Wholesale Factory Free Sample Blank Fashion Lanyards,/contact us by Wechatname:Sunny22345,$0.12-0.62,Min. order: 100 pieces LanyardMin. order: 100 pieces
https://s.alicdn.com/@sc04/kf/H143aff00284548a9986b6154d5219e52u.jpg,https://img.alicdn.com/imgextra/i2/3028865584/O1CN01IwkAMF1r7WfFrFpTJ_!!3028865584.jpg,Personalized Gifts Silicone Lanyards Cell Phone Strap Lanyard Crossbody advertising hand polyester lanyards,/contact us by Wechatname:Sunny22345,$0.14-0.29,Min. order: 500 pieces LanyardsMin. order: 500 pieces
https://s.alicdn.com/@sc04/kf/H2990c7eaf99149f4acf599431e94f744h.jpg,https://img.alicdn.com/imgextra/i2/3028865584/O1CN01IwkAMF1r7WfFrFpTJ_!!3028865584.jpg,Safety Buckle Classic Solid Color Biodegradable Neck Lanyards Rope Custom Sublimation Polyester Exhibition Badge Hanging Strap,/contact us by Wechatname:Sunny22345,$0.18-0.25,Min. order: 100 pieces LanyardsMin. order: 100 pieces
https://s.alicdn.com/@sc04/kf/H3df530b74aa4491f9976e68aa022f0e08.jpg,https://img.alicdn.com/imgextra/i2/3028865584/O1CN01IwkAMF1r7WfFrFpTJ_!!3028865584.jpg,Factory Vendors Oem Keychain Phone Neck Woven Satin Lanyards Nylon Polyester Lanyard With Logo Custom,/contact us by Wechatname:Sunny22345,$0.15-0.80,Min. order: 100 pieces LanyardsMin. order: 100 pieces
https://s.alicdn.com/@sc04/kf/Hc1e926e4544f450f8ef96b4b1780d8c2s.jpg,https://img.alicdn.com/imgextra/i2/3028865584/O1CN01IwkAMF1r7WfFrFpTJ_!!3028865584.jpg,No minimum order custom silk nylon unique logo lanyard with Authentication,/contact us by Wechatname:Sunny22345,$0.11-0.23,Min. order: 100 pieces lanyardMin. order: 100 pieces
https://s.alicdn.com/@sc04/kf/H83a995ca84b14d54afeb08d071a67dc7U.jpg,https://img.alicdn.com/imgextra/i2/3028865584/O1CN01IwkAMF1r7WfFrFpTJ_!!3028865584.jpg,2024 Hot Sale Popular Custom Logo Printed Id Card Neck Strap Kpop Lanyards,/contact us by Wechatname:Sunny22345,$0.18-0.80,Min. order: 50 pieces LanyardsMin. order: 50 pieces
https://s.alicdn.com/@sc04/kf/H86c14b4368e04156904665869280d63bT.jpg,https://img.alicdn.com/imgextra/i2/3028865584/O1CN01IwkAMF1r7WfFrFpTJ_!!3028865584.jpg,"Wholesale Soft Silicone Phone Lanyard, Short Rubber Cell Phone id card badge holder Lanyards With Silicone",/contact us by Wechatname:Sunny22345,$0.10-0.25,Min. order: 100 pieces LanyardMin. order: 100 pieces
https://s.alicdn.com/@sc04/kf/H240821586cd3442198844e0afbc366e04.jpg,https://img.alicdn.com/imgextra/i2/3028865584/O1CN01IwkAMF1r7WfFrFpTJ_!!3028865584.jpg,High Quality Custom Polyester Neck Strap Lanyard with ID Card Badge Holder,/contact us by Wechatname:Sunny22345,$0.62,Min. order: 101 pieces LanyardMin. order: 101 pieces
https://s.alicdn.com/@sc04/kf/H9a1e3ea43f054d6ba82b524eac4a9c1ck.jpg,https://img.alicdn.com/imgextra/i2/3028865584/O1CN01IwkAMF1r7WfFrFpTJ_!!3028865584.jpg,Wholesale Manufacturer 32 Team NFL Soccer Club Long Lanyards American Football NFL Polyester Lanyards,/contact us by Wechatname:Sunny22345,$0.48-0.69,Min. order: 50 pieces LanyardsMin. order: 50 pieces
https://s.alicdn.com/@sc04/kf/Haf85e8cc63ad436c9d0c6979ed2fb659e.jpg,https://img.alicdn.com/imgextra/i2/3028865584/O1CN01IwkAMF1r7WfFrFpTJ_!!3028865584.jpg,Fast Shipping Eco-Rpet Material High Quality Cheap Custom Logo Printed Poly Lanyard For Phone Mobile Drink Tube,/contact us by Wechatname:Sunny22345,$0.15-0.20,Min. order: 100 pieces LanyardMin. order: 100 pieces
https://s.alicdn.com/@sc04/kf/H70e26909f6e5422382e96fe0602089b1y.jpg,https://img.alicdn.com/imgextra/i2/3028865584/O1CN01IwkAMF1r7WfFrFpTJ_!!3028865584.jpg,Hot Custom Logo Dye Sublimation Polyester Keychain Lanyard Wholesale Neck Lanyard Strap,/contact us by Wechatname:Sunny22345,$0.22-0.40,Min. order: 100 pieces LanyardMin. order: 100 pieces
https://s.alicdn.com/@sc04/kf/H93ab36e73c524a2998b5264ca792cbe4X.jpg,https://img.alicdn.com/imgextra/i2/3028865584/O1CN01IwkAMF1r7WfFrFpTJ_!!3028865584.jpg,New Color Clashing Cell Phone Lanyard Short Braided Double Rope Hand Carry Anti-Lost Wrist Lanyard Bag Key Decoration Strap,/contact us by Wechatname:Sunny22345,$0.51,Min. order: 20 pieces LanyardMin. order: 20 pieces
https://s.alicdn.com/@sc04/kf/H61e3a8a6e0304da299eaeee71ecfaa70G.jpg,https://img.alicdn.com/imgextra/i2/3028865584/O1CN01IwkAMF1r7WfFrFpTJ_!!3028865584.jpg,Factory Custom High Quality Neck Lanyard Bulk Promotional Polyester Lanyards,/contact us by Wechatname:Sunny22345,$0.57,Min. order: 100 pieces LanyardMin. order: 100 pieces
https://s.alicdn.com/@sc04/kf/Hcb39e9af653f4b10bcb321d1575468e2F.jpg,https://img.alicdn.com/imgextra/i2/3028865584/O1CN01IwkAMF1r7WfFrFpTJ_!!3028865584.jpg,Wholesale Cheap Factory Directly Neck Lanyard for ID Badge Holder Polyester Lanyard 10mm Available at Bulk Quantity,/contact us by Wechatname:Sunny22345,$0.09-0.15,Min. order: 100 pieces LanyardMin. order: 100 pieces
https://s.alicdn.com/@sc04/kf/H90787c00c56d468b9a81dac7f9fdaea4P.jpg,https://img.alicdn.com/imgextra/i2/3028865584/O1CN01IwkAMF1r7WfFrFpTJ_!!3028865584.jpg,Custom lanyards,/contact us by Wechatname:Sunny22345,$0.85-1.00,Min. order: 100 pieces lanyardsMin. order: 100 pieces
https://s.alicdn.com/@sc04/kf/H96e8d4f428e347a384fa24bfee6481b0a.jpg,https://img.alicdn.com/imgextra/i2/3028865584/O1CN01IwkAMF1r7WfFrFpTJ_!!3028865584.jpg,"customized printed neck lanyard custom lanyards with mobile phone strip,Customize your Own Key Lanyard",/contact us by Wechatname:Sunny22345,$0.15-0.45,Min. order: 100 pieces lanyardMin. order: 100 pieces
https://s.alicdn.com/@sc04/kf/He30f9b9732f84a19b8aae5c9f3fa5de96.jpg,https://img.alicdn.com/imgextra/i2/3028865584/O1CN01IwkAMF1r7WfFrFpTJ_!!3028865584.jpg,Factory directly sale New JDM Style For Motorcycles Lanyard Cellphone Lanyards JDM Refitting Racing Car Keychain,/contact us by Wechatname:Sunny22345,$0.60,Min. order: 50 pieces LanyardMin. order: 50 pieces
https://s.alicdn.com/@sc04/kf/H08f8d8cb012b4fa6be4742a77e2a1cccc.jpg,https://img.alicdn.com/imgextra/i2/3028865584/O1CN01IwkAMF1r7WfFrFpTJ_!!3028865584.jpg,Factory Customized Wholesale Work Card Lanyard Jacquard Detachable Logo Polyester Lanyard with Keyring,/contact us by Wechatname:Sunny22345,$0.20-0.68,Min. order: 100 bags LanyardMin. order: 100 bags
https://s.alicdn.com/@sc04/kf/H938a7611b5e44c66aefd1250a8a485a0b.jpg,https://img.alicdn.com/imgextra/i2/3028865584/O1CN01IwkAMF1r7WfFrFpTJ_!!3028865584.jpg,Custom High Quality Polyester Alpha Phi Alpha Woven Lanyard Neck ID Card Holder Graduation Gift for Sorority Sister,/contact us by Wechatname:Sunny22345,$0.49-0.79,Min. order: 100 pieces LanyardMin. order: 100 pieces
https://s.alicdn.com/@sc04/kf/Hda13261bf6f94f649f0e523f1c2b1846u.jpg,https://img.alicdn.com/imgextra/i2/3028865584/O1CN01IwkAMF1r7WfFrFpTJ_!!3028865584.jpg,Cheap Price Lanyard Custom Logo Wholesale KeyChain Lanyard With ID Card lanyard custom,/contact us by Wechatname:Sunny22345,$0.12-0.45,Min. order: 100 pieces LanyardMin. order: 100 pieces
https://s.alicdn.com/@sc04/kf/He12d05d79a2b42548fb77b2ffd571d35j.jpg,https://img.alicdn.com/imgextra/i2/3028865584/O1CN01IwkAMF1r7WfFrFpTJ_!!3028865584.jpg,Manufacturer Low Price Red Woven Lanyards With Logo Custom Silkscreen Lanyard With Leather Logo,/contact us by Wechatname:Sunny22345,$0.15-0.35,Min. order: 100 pieces LanyardsMin. order: 100 pieces
https://s.alicdn.com/@sc04/kf/H7586d8faff1d4f0cb27bd9447c591fd0R.png,https://img.alicdn.com/imgextra/i2/3028865584/O1CN01IwkAMF1r7WfFrFpTJ_!!3028865584.jpg,High Quality Polyester Lanyard Neck Strap for mobile phone Key chain with your own design,/contact us by Wechatname:Sunny22345,$0.28-0.33,Min. order: 100 pieces LanyardMin. order: 100 pieces
https://s.alicdn.com/@sc04/kf/H0ceab947808646d88e044b848f5c48e9E.jpg,https://img.alicdn.com/imgextra/i2/3028865584/O1CN01IwkAMF1r7WfFrFpTJ_!!3028865584.jpg,Custom Silk Screen Printing logo Stitch Safety Breakaway Buckle Events ID Badge Lobster Clasp Neck Long Lanyard,/contact us by Wechatname:Sunny22345,$0.10-0.76,Min. order: 100 pieces LanyardMin. order: 100 pieces
https://s.alicdn.com/@sc04/kf/H68e64018008c408493c95f96635cac69B.jpg,https://img.alicdn.com/imgextra/i2/3028865584/O1CN01IwkAMF1r7WfFrFpTJ_!!3028865584.jpg,No MOQ Whole sale High Quality plain lanyard solid color Promotional Gift Custom logo Recycled Polyester Lanyard,/contact us by Wechatname:Sunny22345,$1.19-2.36,Min. order: 100 pieces lanyardMin. order: 100 pieces
https://s.alicdn.com/@sc04/kf/H097a472a37094477a450dc0c25d8f977H.jpg,https://img.alicdn.com/imgextra/i2/3028865584/O1CN01IwkAMF1r7WfFrFpTJ_!!3028865584.jpg,Hot Sale Fabric Polyester Lanyards With Logo Custom Polyester Neck Lanyard "Lanyard Good Price Lanyard,/contact us by Wechatname:Sunny22345,$0.05-0.50,Min. order: 50 pieces LanyardsMin. order: 50 pieces
https://s.alicdn.com/@sc04/kf/H122273a9c1b14a0283c2fba1517eda50Z.jpg,https://img.alicdn.com/imgextra/i2/3028865584/O1CN01IwkAMF1r7WfFrFpTJ_!!3028865584.jpg,Eco-friendly Hot Selling Polyester Lanyard printed Personalized Lanyards With Logo Custom,/contact us by Wechatname:Sunny22345,$0.18-0.40,Min. order: 100 pieces LanyardMin. order: 100 pieces
https://s.alicdn.com/@sc04/kf/H668c5f9d3c4c4214afd6435286437c3fY.jpg,https://img.alicdn.com/imgextra/i2/3028865584/O1CN01IwkAMF1r7WfFrFpTJ_!!3028865584.jpg,Hot selling mobile phone lanyard with buckle key popular certificate lanyard polyester lanyard custom wholesale,/contact us by Wechatname:Sunny22345,$0.50-0.63,Min. order: 100 pieces lanyardMin. order: 100 pieces
https://s.alicdn.com/@sc04/kf/H854df04fcf7a446eafa93917b67ec1e2O.png,https://img.alicdn.com/imgextra/i2/3028865584/O1CN01IwkAMF1r7WfFrFpTJ_!!3028865584.jpg,Promotional Personalized Custom Medallion Polyester Printing Medal Lanyard For Festivals,/contact us by Wechatname:Sunny22345,$0.13-0.45,Min. order: 100 pieces LanyardMin. order: 100 pieces
https://s.alicdn.com/@sc04/kf/Hb725093a4208403c82e9faa29ada5c5e3.jpg,https://img.alicdn.com/imgextra/i2/3028865584/O1CN01IwkAMF1r7WfFrFpTJ_!!3028865584.jpg,Good quality lanyards sublimation custom design double side logo with metal hook polyester lanyards,/contact us by Wechatname:Sunny22345,$0.08-0.28,Min. order: 100 pieces lanyardsMin. order: 100 pieces
https://s.alicdn.com/@sc04/kf/H9985045c494d495da3741b73e8f23498N.jpg,https://img.alicdn.com/imgextra/i2/3028865584/O1CN01IwkAMF1r7WfFrFpTJ_!!3028865584.jpg,Promotional lanyard factory custom fashion id card holder polyester Lanyard with printing Logo,/contact us by Wechatname:Sunny22345,$0.17-0.21,"Min. order: 1,000 pieces lanyardMin. order: 1,000 pieces"
https://s.alicdn.com/@sc04/kf/H886d3a111ea34375b451c49a60b6bc28x.png,https://img.alicdn.com/imgextra/i2/3028865584/O1CN01IwkAMF1r7WfFrFpTJ_!!3028865584.jpg,Baltimore Ravens Custom Lanyards 90x2cm Polyester And Keychain Neck Strap Key Chain,/contact us by Wechatname:Sunny22345,$0.60-1.50,Min. order: 20 pieces LanyardsMin. order: 20 pieces
https://s.alicdn.com/@sc04/kf/H68381b18dccf4a7da124b58ba42858a8i.jpg,https://img.alicdn.com/imgextra/i2/3028865584/O1CN01IwkAMF1r7WfFrFpTJ_!!3028865584.jpg,Stylish Leather Lanyard Keychain Sublimation Neck Strap Polyester Lanyard Custom Laynards,/contact us by Wechatname:Sunny22345,$0.45,Min. order: 100 pieces LanyardMin. order: 100 pieces
https://s.alicdn.com/@sc04/kf/He0a2516df8584f17b772a6c1cc9cbf1bV.jpg,https://img.alicdn.com/imgextra/i2/3028865584/O1CN01IwkAMF1r7WfFrFpTJ_!!3028865584.jpg,"No minimum custom printing lanyard, the cheapest lanyard custom your own logo lanyards",/contact us by Wechatname:Sunny22345,$0.50,Min. order: 2 pieces lanyardMin. order: 2 pieces
https://s.alicdn.com/@sc04/kf/Hd922aebec7de45baaf8f4052bb88077aH.jpg,https://img.alicdn.com/imgextra/i2/3028865584/O1CN01IwkAMF1r7WfFrFpTJ_!!3028865584.jpg,Promotional Custom Printed Neck Polyester Lanyard Custom Logo Design Lanyard,/contact us by Wechatname:Sunny22345,$0.90-1.50,Min. order: 50 pieces LanyardMin. order: 50 pieces
https://s.alicdn.com/@sc04/kf/H40020a83266c46e6a16dd8fbf7c85505p.jpg,https://img.alicdn.com/imgextra/i2/3028865584/O1CN01IwkAMF1r7WfFrFpTJ_!!3028865584.jpg,20*900mm Durable 100% Polyester Id Lace Lanyard for Company Staff with Customization Logo,/contact us by Wechatname:Sunny22345,$0.50,Min. order: 100 pieces LanyardMin. order: 100 pieces
https://s.alicdn.com/@sc04/kf/He40df7a0925140c380a0490e660ad39d9.jpg,https://img.alicdn.com/imgextra/i2/3028865584/O1CN01IwkAMF1r7WfFrFpTJ_!!3028865584.jpg,Silkscreen Printing Lanyard With Full Color Print Single Double Sided Printed Lanyards Promotional Custom Polyester Lanyard,/contact us by Wechatname:Sunny22345,$0.14,"Min. order: 1,000 pieces LanyardMin. order: 1,000 pieces"
https://s.alicdn.com/@sc04/kf/Hde78acb0bff04e51999e65959ed63b63l.png,https://img.alicdn.com/imgextra/i2/3028865584/O1CN01IwkAMF1r7WfFrFpTJ_!!3028865584.jpg,Custom Key Seatbelt Buckle Fabric Ribbon Long Keychain Lanyard Eagle Mouth Metal Hook,/contact us by Wechatname:Sunny22345,$0.12-0.35,Min. order: 100 pieces LanyardMin. order: 100 pieces
https://s.alicdn.com/@sc04/kf/H44c622025ce6422592a5229eb955556f8.jpg,https://img.alicdn.com/imgextra/i2/3028865584/O1CN01IwkAMF1r7WfFrFpTJ_!!3028865584.jpg,High-quality polyester sublimation oem custom lanyards neck strap fashion polyester lanyard with custom logo attached,/contact us by Wechatname:Sunny22345,$0.11-0.35,Min. order: 100 pieces lanyardsMin. order: 100 pieces
https://s.alicdn.com/@sc04/kf/H60732d49a3804bae999d262604270f538.jpg,https://img.alicdn.com/imgextra/i2/3028865584/O1CN01IwkAMF1r7WfFrFpTJ_!!3028865584.jpg,Manufacturer Cheap Personalized Neck Tool Printing Polyester Sublimation Custom Lanyards With Logo Custom,/contact us by Wechatname:Sunny22345,$0.39,Min. order: 100 pieces LanyardsMin. order: 100 pieces
https://s.alicdn.com/@sc04/kf/H9e000b26891043c5806118f92f5d2e689.jpg,https://img.alicdn.com/imgextra/i2/3028865584/O1CN01IwkAMF1r7WfFrFpTJ_!!3028865584.jpg,Custom Logo Strap Printed Wrist Sunglasses Pen Holder For Office Floating Diving Anti Lost Soft Neck Phone Lanyard,/contact us by Wechatname:Sunny22345,$0.1355-0.2574,Min. order: 2 pieces LanyardMin. order: 2 pieces
https://s.alicdn.com/@sc04/kf/H98f9ffe3bd3e45879795501f26bf113f1.jpg,https://img.alicdn.com/imgextra/i2/3028865584/O1CN01IwkAMF1r7WfFrFpTJ_!!3028865584.jpg,2024 High Quality ECO Friendly Material Phone Polyester Lanyard with logo custom,/contact us by Wechatname:Sunny22345,$0.34-0.38,"Min. order: 1,000 pieces LanyardMin. order: 1,000 pieces"
https://s.alicdn.com/@sc04/kf/Hf972851deb024fe086079b6c0447b108O.jpg,https://img.alicdn.com/imgextra/i2/3028865584/O1CN01IwkAMF1r7WfFrFpTJ_!!3028865584.jpg,Promotion Lanyards Round Polyester Keychain Lanyard Phone Lanyard,/contact us by Wechatname:Sunny22345,$0.99,"Min. order: 1,000 pieces LanyardsMin. order: 1,000 pieces"
https://s.alicdn.com/@sc04/kf/H0652fe0229504269b5e2c34ef4856f0fO.jpg,https://img.alicdn.com/imgextra/i2/3028865584/O1CN01IwkAMF1r7WfFrFpTJ_!!3028865584.jpg,multifunctional custom polyester lanyard hanging rope thermal transfer Work card lanyard with logo nylon lanyard,/contact us by Wechatname:Sunny22345,$0.25-0.29,Min. order: 100 sets lanyardMin. order: 100 sets
https://s.alicdn.com/@sc04/kf/Hd732d07ba6994a97be65fc2b74e9ad54i.jpg,https://img.alicdn.com/imgextra/i2/3028865584/O1CN01IwkAMF1r7WfFrFpTJ_!!3028865584.jpg,Personalized Lanyards With Logo Sublimation Custom Printed Lanyards 20mm Custom Lanyards No Minimum Order,/contact us by Wechatname:Sunny22345,$0.10-0.45,Min. order: 50 pieces LanyardsMin. order: 50 pieces
https://s.alicdn.com/@sc04/kf/Hbba0f714884a4ddf8cfeb02093d31506N.jpg,https://img.alicdn.com/imgextra/i2/3028865584/O1CN01IwkAMF1r7WfFrFpTJ_!!3028865584.jpg,High Quality Long Durable Faux Leather Lanyard With Custom Logo,/contact us by Wechatname:Sunny22345,$0.33,"Min. order: 1,000 pieces LanyardMin. order: 1,000 pieces"
https://s.alicdn.com/@sc04/kf/H4f94832eb93d47c481742058c0c5c2d2P.jpg,https://img.alicdn.com/imgextra/i2/3028865584/O1CN01IwkAMF1r7WfFrFpTJ_!!3028865584.jpg,Free Sample Phone Patch Country Flag Custom Car Key Lanyards,/contact us by Wechatname:Sunny22345,$0.20-0.25,"Min. order: 100 units Lanyards16,357 sold"
https://s.alicdn.com/@sc04/kf/Ha997641ce4ac4c0db41978e7caa10ba2m.jpg,https://img.alicdn.com/imgextra/i2/3028865584/O1CN01IwkAMF1r7WfFrFpTJ_!!3028865584.jpg,No Minimum Order Manufacture Lanyard For Mobile Phone Lanyard Patch Custom Design Lanyard,/contact us by Wechatname:Sunny22345,$0.30,Min. order: 20 pieces Lanyard3 sold
https://s.alicdn.com/@sc04/kf/Hbe959c4c43a147e29a69c9ff02886898i.jpg,https://img.alicdn.com/imgextra/i2/3028865584/O1CN01IwkAMF1r7WfFrFpTJ_!!3028865584.jpg,Premium Custom Colorful ID Card Neck Strap Keychain Necklace Lanyard,/contact us by Wechatname:Sunny22345,$0.20-0.50,"Min. order: 2,000 pieces Lanyard1 view"
https://s.alicdn.com/@sc04/kf/H820372dc542446acae2e4ade26e13c6bV.jpg,https://img.alicdn.com/imgextra/i2/3028865584/O1CN01IwkAMF1r7WfFrFpTJ_!!3028865584.jpg,Custom lanyards high quality polyester phone printed design sublimation woven wrist lanyard with logo custom strap keychain,/contact us by Wechatname:Sunny22345,$0.12-0.38,Min. order: 50 pieces lanyards
https://s.alicdn.com/@sc04/kf/Hf7f019bf77ee493294d4d9a027b939f26.jpg,https://img.alicdn.com/imgextra/i2/3028865584/O1CN01IwkAMF1r7WfFrFpTJ_!!3028865584.jpg,Best Quality Custom Logo Dye Sublimation Printing Polyester Lanyard Wholesale Neck Lanyard Strap Silk Printing Lanyard Ribbon,/contact us by Wechatname:Sunny22345,$0.19-0.23,Min. order: 100 pieces Lanyard1 view
https://s.alicdn.com/@sc04/kf/He99e1530ad324816b2f9b0742531ad26K.jpg,https://img.alicdn.com/imgextra/i2/3028865584/O1CN01IwkAMF1r7WfFrFpTJ_!!3028865584.jpg,Wholesale Oem Blank Sublimation Polyester Nylon Plain Cheap Personalized Custom Logo Printed Lanyard,/contact us by Wechatname:Sunny22345,$0.35,Min. order: 500 pieces Lanyard
https://s.alicdn.com/@sc04/kf/H0343fae3c0864f93a000ac904055feadY.jpg,https://img.alicdn.com/imgextra/i2/3028865584/O1CN01IwkAMF1r7WfFrFpTJ_!!3028865584.jpg,High quality personalized custom logo silk screen printed polyester airline airbus air lanyard for staff free sample,/contact us by Wechatname:Sunny22345,$0.14-0.24,Min. order: 100 pieces lanyard2 views
https://s.alicdn.com/@sc04/kf/Hb14b91ca26154306bf8824cefc2fc587f.jpg,https://img.alicdn.com/imgextra/i2/3028865584/O1CN01IwkAMF1r7WfFrFpTJ_!!3028865584.jpg,High end phone lanyards with logo custom,/contact us by Wechatname:Sunny22345,$0.15-0.50,Min. order: 10 pieces lanyards
https://s.alicdn.com/@sc04/kf/H3f45fc77a77d420a93b52aa891f90f13x.jpg,https://img.alicdn.com/imgextra/i2/3028865584/O1CN01IwkAMF1r7WfFrFpTJ_!!3028865584.jpg,High Quality Lanyard With Card Holder Custom Pattern Various Accessories Wholesale High Quality Sublimation Lanyards,/contact us by Wechatname:Sunny22345,$0.16,Min. order: 100 pieces Lanyard
https://s.alicdn.com/@sc04/kf/H57e80ee81f97449f99b8ffd2beb03f66X.jpg,https://img.alicdn.com/imgextra/i2/3028865584/O1CN01IwkAMF1r7WfFrFpTJ_!!3028865584.jpg,Custom Phone Lanyards Polyester Lanyard With ID Card Badge Holder,/contact us by Wechatname:Sunny22345,$0.18-0.30,Min. order: 100 pieces Lanyards
https://s.alicdn.com/@sc04/kf/H38a42810475641b2b459e333247dd470w.jpg,https://img.alicdn.com/imgextra/i2/3028865584/O1CN01IwkAMF1r7WfFrFpTJ_!!3028865584.jpg,Wholesale lanyards with logo custom Polyester Printed Neck Lanyard With Heat Transfer Printed Logo,/contact us by Wechatname:Sunny22345,$0.21-0.32,Min. order: 500 pieces lanyards
https://s.alicdn.com/@sc04/kf/Heff2c618aaa240d983b0caec11c2d67f3.jpg,https://img.alicdn.com/imgextra/i2/3028865584/O1CN01IwkAMF1r7WfFrFpTJ_!!3028865584.jpg,Mini Series Neck Strap Lanyards for Keys ID Card Gym Cell Phone Straps USB Badge Holder DIY Phone Hanging Rope Lanyard,/contact us by Wechatname:Sunny22345,$0.30-0.45,Min. order: 20 pieces Lanyards
