image_url1,image_url2,product_name,contact,price,MOQ
https://s.alicdn.com/@sc04/kf/H59d80bbc965c44888d4e4eb781b911e3t.jpg_300x300.jpg,https://img.alicdn.com/imgextra/i3/3028865584/O1CN01micZy61r7WfFIOiJy_!!3028865584.jpg,Custom Logo Plastic PVC Silicone Cup Holder Lanyard For Cups Water Drink Bottle Strap Lanyard Cup Holders,/contact us by Wechatname:Sunny22345,$0.20-0.30,Min. order: 100 pieces
https://s.alicdn.com/@sc04/kf/H9387ad734aa74be382ae54e73dd69d27v.jpg_300x300.jpg,https://img.alicdn.com/imgextra/i3/3028865584/O1CN01micZy61r7WfFIOiJy_!!3028865584.jpg,Customized Sublimation Printer Polyester Lanyard ID Card With Neck Strap,/contact us by Wechatname:Sunny22345,$0.14-0.29,Min. order: 500 pieces
https://s.alicdn.com/@sc04/kf/H293387bb752646e3ba65897587a036271.jpg_300x300.jpg,https://img.alicdn.com/imgextra/i3/3028865584/O1CN01micZy61r7WfFIOiJy_!!3028865584.jpg,Personalized pvc patch custom embossed 3d soft pvc custom rubber badge heat transfer logo badge pvc patch,/contact us by Wechatname:Sunny22345,$0.30-0.40,Min. order: 100 pieces
https://s.alicdn.com/@sc04/kf/Hc14ed84b6f564941a1e8fdd6e5416b6ee.jpg_300x300.jpg,https://img.alicdn.com/imgextra/i3/3028865584/O1CN01micZy61r7WfFIOiJy_!!3028865584.jpg,New Style Lanyard Strap for Phone Elastic Spring Lanyard Anti-theft Lanyard Used in Multiple Scenarios,/contact us by Wechatname:Sunny22345,$1.95-2.28,Min. order: 10 pieces
https://s.alicdn.com/@sc04/kf/H8bead02f97df4ca284a14b530ab300e48.jpg_300x300.jpg,https://img.alicdn.com/imgextra/i3/3028865584/O1CN01micZy61r7WfFIOiJy_!!3028865584.jpg,2024 new design factory OEM or ODM directly PVC lanyard customization according any of your design Promotion gifts,/contact us by Wechatname:Sunny22345,$0.30,"Min. order: 3,000 pieces"
https://s.alicdn.com/@sc04/kf/H95d946c264d5466faf0d96efe096a17aA.jpg_300x300.jpg,https://img.alicdn.com/imgextra/i3/3028865584/O1CN01micZy61r7WfFIOiJy_!!3028865584.jpg,Manufacturer Custom Sublimation Neck Polyester Lanyard With ID Card,/contact us by Wechatname:Sunny22345,$0.69,Min. order: 500 sets
https://s.alicdn.com/@sc04/kf/Hd8ff9cafa9464b41aa22fce202d57548L.jpg_300x300.jpg,https://img.alicdn.com/imgextra/i3/3028865584/O1CN01micZy61r7WfFIOiJy_!!3028865584.jpg,New Wristlet Lanyard Rhinestone Bling Rhinestone Strap Key Chains for Women Shiny Lanyard for Keys Glitter Keychain Wrist Holder,/contact us by Wechatname:Sunny22345,$0.68-0.78,Min. order: 3 pieces
https://s.alicdn.com/@sc04/kf/Hc6c34db4a3714587b40c41ac63bb0fb2o.png_300x300.png,https://img.alicdn.com/imgextra/i3/3028865584/O1CN01micZy61r7WfFIOiJy_!!3028865584.jpg,Soft PVC Clear Card Pocket Credit ID Card Size in Stock Lanyard Accessories,/contact us by Wechatname:Sunny22345,$0.07-0.08,"Min. order: 1,000 pieces"
https://s.alicdn.com/@sc04/kf/H628ca02241b64e79943178c53a8e35c4f.jpg_300x300.jpg,https://img.alicdn.com/imgextra/i3/3028865584/O1CN01micZy61r7WfFIOiJy_!!3028865584.jpg,Hot Day Wholesale Anime Design Cartoon Oriental Cherry Lanyard Anime ID Card Key Phone Keychain Pvc Lanyards,/contact us by Wechatname:Sunny22345,$1.53-1.62,Min. order: 100 pieces
https://s.alicdn.com/@sc04/kf/H5f0c56bc1fb8411a963d5b54bb54eaf3o.jpg_300x300.jpg,https://img.alicdn.com/imgextra/i3/3028865584/O1CN01micZy61r7WfFIOiJy_!!3028865584.jpg,Wholesale Custom PVC Lanyard Blank Neck Strap Lanyard for ID Card Holder in Office,/contact us by Wechatname:Sunny22345,$0.25-0.47,"Min. order: 1,000 pieces"
https://s.alicdn.com/@sc04/kf/H9214cc64d8354db98ab0a7046fc036c8a.jpg_300x300.jpg,https://img.alicdn.com/imgextra/i3/3028865584/O1CN01micZy61r7WfFIOiJy_!!3028865584.jpg,Fashion Cute BlingBling Beaded Chain Beauty Kids Student Bow Charms Glass Acrylic Mobile Phone Lanyard,/contact us by Wechatname:Sunny22345,$1.10-1.32,Min. order: 12 pairs
https://s.alicdn.com/@sc04/kf/H55300832fc944ec988a3018542a2fa22S.jpg_300x300.jpg,https://img.alicdn.com/imgextra/i3/3028865584/O1CN01micZy61r7WfFIOiJy_!!3028865584.jpg,Lanyard Heat Press Wrist Phone Cheap Id Adjustable Cord Duck Bahan Sunglass Strap Teacher Pvc Lanyards for Id Badges,/contact us by Wechatname:Sunny22345,$0.11-0.32,Min. order: 100 pieces
https://s.alicdn.com/@sc04/kf/H79c8018769af4e1fa721820ca7e99f1eW.jpg_300x300.jpg,https://img.alicdn.com/imgextra/i3/3028865584/O1CN01micZy61r7WfFIOiJy_!!3028865584.jpg,custom different style good quality colorful zipper puller rope clothing bags removable lanyard rubber zipper puller zipper pull,/contact us by Wechatname:Sunny22345,$0.06,"Min. order: 1,000 pieces"
https://s.alicdn.com/@sc04/kf/H9098bcd179b04b0bb7d42e36dcb4f0347.jpg_300x300.jpg,https://img.alicdn.com/imgextra/i3/3028865584/O1CN01micZy61r7WfFIOiJy_!!3028865584.jpg,San-X SUMIKKO GURASHI Women Men Business Card Holder Cartoon Cute Retractable Credit Card Holders Bank Id Holders Badge Child Bu,/contact us by Wechatname:Sunny22345,$0.41-0.43,Min. order: 10 pieces
https://s.alicdn.com/@sc04/kf/H8eeebe409b694bb69efc1d9336d86df10.jpg_300x300.jpg,https://img.alicdn.com/imgextra/i3/3028865584/O1CN01micZy61r7WfFIOiJy_!!3028865584.jpg,Custom Puerto Rico Keychain Printed Neck Strap Lanyard Sling Id Badge Holders Lanyard Pvc Name Card Polyester Keychain Lanyard,/contact us by Wechatname:Sunny22345,$0.49-0.79,Min. order: 100 pieces
https://s.alicdn.com/@sc04/kf/Heab3d05b0f6f4e22bab43b58e5fa7c88g.jpg_300x300.jpg,https://img.alicdn.com/imgextra/i3/3028865584/O1CN01micZy61r7WfFIOiJy_!!3028865584.jpg,Logo Led Strap Pvc High Quality Laynard Polyester Custom Keychain Lanyard With Clear Id,/contact us by Wechatname:Sunny22345,$0.06-0.28,Min. order: 50 pieces
https://s.alicdn.com/@sc04/kf/H57d0a60cab6c45408d29b5d1768ae0daM.jpg_300x300.jpg,https://img.alicdn.com/imgextra/i3/3028865584/O1CN01micZy61r7WfFIOiJy_!!3028865584.jpg,New Mobile Phone Bracket Leather Card Sticker Creative Personality Small Gift Wristband Bracket Card Sleeve,/contact us by Wechatname:Sunny22345,$0.78-1.62,Min. order: 100 pieces
https://s.alicdn.com/@sc04/kf/Hef152bf9442f409dad44ab0722c22e32O.jpg_300x300.jpg,https://img.alicdn.com/imgextra/i3/3028865584/O1CN01micZy61r7WfFIOiJy_!!3028865584.jpg,Custom Branding Name Badge Holder Transfer Lanyard Safety Release Clip Sublimation Blank Lanyard For Keys,/contact us by Wechatname:Sunny22345,$0.22-0.30,Min. order: 500 pieces
https://s.alicdn.com/@sc04/kf/H91994934778c4095b73d505639716564M.jpg_300x300.jpg,https://img.alicdn.com/imgextra/i3/3028865584/O1CN01micZy61r7WfFIOiJy_!!3028865584.jpg,Factory custom Cell Phone Neck Strap pvc Lanyard for ID Card DIY Lanyards Rope Mobile Accessories,/contact us by Wechatname:Sunny22345,$0.36-0.43,Min. order: 100 pieces
https://s.alicdn.com/@sc04/kf/H8b7d8f79f22249498225e86040acd15de.jpg_300x300.jpg,https://img.alicdn.com/imgextra/i3/3028865584/O1CN01micZy61r7WfFIOiJy_!!3028865584.jpg,14 Styles New Hazbin Hotel Neck Strap Card Holder Bag Anime Phone Strap Lanyard wholesale,/contact us by Wechatname:Sunny22345,$0.99-1.49,Min. order: 50 pieces
https://s.alicdn.com/@sc04/kf/H963fb953339c409ca999248a21056034t.jpg_300x300.jpg,https://img.alicdn.com/imgextra/i3/3028865584/O1CN01micZy61r7WfFIOiJy_!!3028865584.jpg,High Quality Customized PVC Logo Lanyards Heat Transfer Stamping Logo Promotion Gift Whistle Safety Buckle Lanyard,/contact us by Wechatname:Sunny22345,$0.08-0.45,Min. order: 100 pieces
https://s.alicdn.com/@sc04/kf/H851ef228ec1c465289f99e4e7a20588c4.jpg_300x300.jpg,https://img.alicdn.com/imgextra/i3/3028865584/O1CN01micZy61r7WfFIOiJy_!!3028865584.jpg,Rope Phone Camera Strap Promotional Lanyards Polyester Lanyard,/contact us by Wechatname:Sunny22345,$0.89-1.00,Min. order: 2 pieces
https://s.alicdn.com/@sc04/kf/Hefc7e43e7cb44a06ad88dceaf05d16d33.jpg_300x300.jpg,https://img.alicdn.com/imgextra/i3/3028865584/O1CN01micZy61r7WfFIOiJy_!!3028865584.jpg,Custom Logo Dye Sublimation Polyester Keychain Lanyard Wholesale Neck Lanyard Strap,/contact us by Wechatname:Sunny22345,$0.46-0.55,Min. order: 50 pieces
https://s.alicdn.com/@sc04/kf/Hcc100f0c2d6c4e5c8bb3209af4421d81n.jpg_300x300.jpg,https://img.alicdn.com/imgextra/i3/3028865584/O1CN01micZy61r7WfFIOiJy_!!3028865584.jpg,Custom Logo Printed Neck Strap Lanyard Sling Id Badge Holders Lanyard And Pvc Name Card Polyester Keychain Lanyard,/contact us by Wechatname:Sunny22345,$0.07-0.20,Min. order: 500 pieces
https://s.alicdn.com/@sc04/kf/H4eeacd2711ae4a1a863e20acffac705bs.jpg_300x300.jpg,https://img.alicdn.com/imgextra/i3/3028865584/O1CN01micZy61r7WfFIOiJy_!!3028865584.jpg,Custom Soft PVC Rubber Logo Neck Strap Silk Screen Printed Silicone Lanyard With Safety Breakaway,/contact us by Wechatname:Sunny22345,$0.15-0.40,Min. order: 100 pieces
https://s.alicdn.com/@sc04/kf/Hccac811803074835a1f7413b14184195E.jpg_300x300.jpg,https://img.alicdn.com/imgextra/i3/3028865584/O1CN01micZy61r7WfFIOiJy_!!3028865584.jpg,Wholesale spot Stitch cartoon id card cover cute anime printed pvc plastic photocard holder with hanging lanyard,/contact us by Wechatname:Sunny22345,$0.25-0.39,Min. order: 50 pieces
https://s.alicdn.com/@sc04/kf/H714e12d9d2cf41b78e0fc4427d997864P.jpg_300x300.jpg,https://img.alicdn.com/imgextra/i3/3028865584/O1CN01micZy61r7WfFIOiJy_!!3028865584.jpg,Wholesale transparent protective waterproof mobile phone bag floating environmental waterproof mobile phone bag with lanyard,/contact us by Wechatname:Sunny22345,$0.29-0.37,Min. order: 10 pieces
https://s.alicdn.com/@sc04/kf/Hadd68a5c5ea541eb99427e4e30b554a7T.png_300x300.png,https://img.alicdn.com/imgextra/i3/3028865584/O1CN01micZy61r7WfFIOiJy_!!3028865584.jpg,Factory direct sale custom detachable Nylon phone diagonal lanyard loss-proof phone lanyard,/contact us by Wechatname:Sunny22345,$1.50-1.90,Min. order: 100 pieces
https://s.alicdn.com/@sc04/kf/H98beb00cdd3547c9968f2225fb4cc8efS.jpg_300x300.jpg,https://img.alicdn.com/imgextra/i3/3028865584/O1CN01micZy61r7WfFIOiJy_!!3028865584.jpg,Customized Black ID card sleeve hanging rope Retractable Easy to Pull Buckle Neck Straps Lanyard With Card Badge Holder,/contact us by Wechatname:Sunny22345,$0.62-0.75,Min. order: 100 pieces
https://s.alicdn.com/@sc04/kf/H2d58fd650a2047d797d91e23a31d9a71C.jpg_300x300.jpg,https://img.alicdn.com/imgextra/i3/3028865584/O1CN01micZy61r7WfFIOiJy_!!3028865584.jpg,New Candy Color Acrylic Chain Mobile Phone Lanyard Fashion Colorful Mobile Phone Chain Hanging Accessories,/contact us by Wechatname:Sunny22345,$0.54-1.56,Min. order: 50 pieces
https://s.alicdn.com/@sc04/kf/Hce448e234c6147be8137ebffcf5f49bbV.jpg_300x300.jpg,https://img.alicdn.com/imgextra/i3/3028865584/O1CN01micZy61r7WfFIOiJy_!!3028865584.jpg,Customized Safety Stainless Rope Diving Fishing Spring Coil Cable Retractable Tool Lanyard for safety,/contact us by Wechatname:Sunny22345,$1.35-1.45,Min. order: 500 pieces
https://s.alicdn.com/@sc04/kf/H93cb20228ec248429a0b6578cdd89963D.jpg_300x300.jpg,https://img.alicdn.com/imgextra/i3/3028865584/O1CN01micZy61r7WfFIOiJy_!!3028865584.jpg,Nuoxin Fast Delivery Custom Design Lanyards Phone Lanyard Lanyards with Logo Custom,/contact us by Wechatname:Sunny22345,$0.19-0.34,Min. order: 100 pieces
https://s.alicdn.com/@sc04/kf/H329169f763f9411481bd110d5de58ebfM.jpg_300x300.jpg,https://img.alicdn.com/imgextra/i3/3028865584/O1CN01micZy61r7WfFIOiJy_!!3028865584.jpg,High Quality Customized Promotional Lanyard and Pvc Holder Lanyard Polyester Lanyard With Logo Credit Name ID Card Holder,/contact us by Wechatname:Sunny22345,$0.58-0.65,Min. order: 100 sets
https://s.alicdn.com/@sc04/kf/H8141a8d31e334336aaf81e30a684fb23a.jpg_300x300.jpg,https://img.alicdn.com/imgextra/i3/3028865584/O1CN01micZy61r7WfFIOiJy_!!3028865584.jpg,High Quality Mobile Phone Strap Hang Around Hand Lanyard With Locking Clasp,/contact us by Wechatname:Sunny22345,$0.19-0.31,"Min. order: 1,000 pieces"
https://s.alicdn.com/@sc04/kf/H7fe599c2fd3840928ebfeb0a0ebd374bs.jpg_300x300.jpg,https://img.alicdn.com/imgextra/i3/3028865584/O1CN01micZy61r7WfFIOiJy_!!3028865584.jpg,BSBH Custom OEM Transparent Rubber Silicone Wrist Strap PVC Jelly Printing Key Chain Lanyard For Decor,/contact us by Wechatname:Sunny22345,$1.50,Min. order: 100 pieces
https://s.alicdn.com/@sc04/kf/He116535418bc4d69a64752f27396e98dv.jpg_300x300.jpg,https://img.alicdn.com/imgextra/i3/3028865584/O1CN01micZy61r7WfFIOiJy_!!3028865584.jpg,2024 Best-Selling Silicone Work Documents Lanyard Creative INS Style Badge Lanyard with Personal Logo Printing Option,/contact us by Wechatname:Sunny22345,$0.20-0.40,Min. order: 100 pieces
https://s.alicdn.com/@sc04/kf/H12d0f095b883450c9d202866f0244cf1S.jpg_300x300.jpg,https://img.alicdn.com/imgextra/i3/3028865584/O1CN01micZy61r7WfFIOiJy_!!3028865584.jpg,Adjustable Cruise Lanyards with Waterproof ID Badge Reel Holder Key Cards,/contact us by Wechatname:Sunny22345,$0.99-1.15,Min. order: 30 pieces
https://s.alicdn.com/@sc04/kf/H1787ec62c4c44680a00b8420f36b491aW.jpg_300x300.jpg,https://img.alicdn.com/imgextra/i3/3028865584/O1CN01micZy61r7WfFIOiJy_!!3028865584.jpg,Customized Laser Printing Work ID Card Holder Sublimation Teacher Neck Polyester Lanyard,/contact us by Wechatname:Sunny22345,$1.50-2.00,Min. order: 100 pieces
https://s.alicdn.com/@sc04/kf/H6d77c9977c0e4582b53cf7b43940d43eR.jpg_300x300.jpg,https://img.alicdn.com/imgextra/i3/3028865584/O1CN01micZy61r7WfFIOiJy_!!3028865584.jpg,Custom Soft Plastic Id Working Name Badge Pvc Card Holder With Neck Strap Polyester Lanyard,/contact us by Wechatname:Sunny22345,$2.20-3.20,Min. order: 30 pieces
https://s.alicdn.com/@sc04/kf/H491aa5d0063c42bebb3233da8f3575bds.jpg_300x300.jpg,https://img.alicdn.com/imgextra/i3/3028865584/O1CN01micZy61r7WfFIOiJy_!!3028865584.jpg,High quality custom ID Case Name Badge PVC Card Holder Polyester Lanyard with Logo Design,/contact us by Wechatname:Sunny22345,$0.76-0.82,Min. order: 1 piece
https://s.alicdn.com/@sc04/kf/H2c561ddc2ce34bca855af25470bad158z.jpg_300x300.jpg,https://img.alicdn.com/imgextra/i3/3028865584/O1CN01micZy61r7WfFIOiJy_!!3028865584.jpg,No Minimum Order Cheap Custom Lanyard Clear PVC Lanyard Bulk White Key Chain Lanyard,/contact us by Wechatname:Sunny22345,$1.13,Min. order: 100 pieces
https://s.alicdn.com/@sc04/kf/H326d1dbe758048b495edcc64de1124bc2.jpg_300x300.jpg,https://img.alicdn.com/imgextra/i3/3028865584/O1CN01micZy61r7WfFIOiJy_!!3028865584.jpg,Kamado Tanjirou Nezuko Kimetsu No Yaiba Demon Slayer Anime PVC Figure Keychain,/contact us by Wechatname:Sunny22345,$0.70-1.15,Min. order: 30 pieces
https://s.alicdn.com/@sc04/kf/Ha3590932c307482a98b050be012d704bN.jpg_300x300.jpg,https://img.alicdn.com/imgextra/i3/3028865584/O1CN01micZy61r7WfFIOiJy_!!3028865584.jpg,Custom Silkscreen Printing Logo Promotion Polyester Airbus Pvc Lanyard With Business ID Card Holder Lanyards for Mobile Phone,/contact us by Wechatname:Sunny22345,$0.03-0.20,Min. order: 100 pieces
https://s.alicdn.com/@sc04/kf/Hfbbe11facf774995bbe322d1b59854fds.jpg_300x300.jpg,https://img.alicdn.com/imgextra/i3/3028865584/O1CN01micZy61r7WfFIOiJy_!!3028865584.jpg,Neck Strap Lanyard Sling ID Badge Holders/Landyard And Pvc Name Card Polyester Lanyard Keychain,/contact us by Wechatname:Sunny22345,$0.40,Min. order: 50 pieces
https://s.alicdn.com/@sc04/kf/Hf7505c57a5e04fdbb3848cdbdb38243fL.jpg_300x300.jpg,https://img.alicdn.com/imgextra/i3/3028865584/O1CN01micZy61r7WfFIOiJy_!!3028865584.jpg,New design custom logo printing blank clear silicone rubber neck strap lanyard brand 90cm soft pvc lanyard with id card holder,/contact us by Wechatname:Sunny22345,$0.20-0.60,Min. order: 20 pieces
https://s.alicdn.com/@sc04/kf/H83bfe8415c8b44c286dd6ea0a58f1431i.jpg_300x300.jpg,https://img.alicdn.com/imgextra/i3/3028865584/O1CN01micZy61r7WfFIOiJy_!!3028865584.jpg,Wholesale Soft Coach Id Transparent Custom PVC Lanyard ID Free Shipping Kpop Blank Safety Breakaway Custom Printed Lanyard,/contact us by Wechatname:Sunny22345,$0.20-0.40,Min. order: 20 pieces
https://s.alicdn.com/@sc04/kf/He72064eae0884a2fa16b5a4e6bb5e3bfl.jpg_300x300.jpg,https://img.alicdn.com/imgextra/i3/3028865584/O1CN01micZy61r7WfFIOiJy_!!3028865584.jpg,Sublimation custom satin lanyard/heat transfer lanyard with soft PVC card holder,/contact us by Wechatname:Sunny22345,$0.15-0.42,Min. order: 10 pieces
https://s.alicdn.com/@sc04/kf/H32b2ac38b2fe4a478af3ce426542c80e6.png_300x300.png,https://img.alicdn.com/imgextra/i3/3028865584/O1CN01micZy61r7WfFIOiJy_!!3028865584.jpg,Apple Iphones 12 Pro Max Case Luxury With Lanyard,/contact us by Wechatname:Sunny22345,$1.05,Min. order: 100 pieces
https://s.alicdn.com/@sc04/kf/H22357497a50c4afbb4a8fe790826a4cdi.jpg_300x300.jpg,https://img.alicdn.com/imgextra/i3/3028865584/O1CN01micZy61r7WfFIOiJy_!!3028865584.jpg,Factory Price Neck Strap Lanyard Safety Breakaway for Mobile Phone USB Holder Badge Holder Keys Metal Clip Lanyard,/contact us by Wechatname:Sunny22345,$0.10-0.20,Min. order: 10 pieces
https://s.alicdn.com/@sc04/kf/H89defdf2cd3e43adbe798fdf9af28e50j.jpg_300x300.jpg,https://img.alicdn.com/imgextra/i3/3028865584/O1CN01micZy61r7WfFIOiJy_!!3028865584.jpg,Various Colors Adjustable Chain Snap Face Kid Breakaway Masking Lanyard for Kids,/contact us by Wechatname:Sunny22345,$0.09-0.14,Min. order: 500 pieces
https://s.alicdn.com/@sc04/kf/H0b07f041e17840008ce2b69fb778b3b4z.jpg_300x300.jpg,https://img.alicdn.com/imgextra/i3/3028865584/O1CN01micZy61r7WfFIOiJy_!!3028865584.jpg,Custom Card Pink Lanyards With Logo Holder Key Printed Champion Designer Id Chain Supplies Car Free Sample Keychain Lanyard,/contact us by Wechatname:Sunny22345,$0.08-0.25,Min. order: 100 pieces
https://s.alicdn.com/@sc04/kf/Hc73f1d22c8e2425c833fd413f8516fdfH.jpg_300x300.jpg,https://img.alicdn.com/imgextra/i3/3028865584/O1CN01micZy61r7WfFIOiJy_!!3028865584.jpg,Soft clear card protector 4*3 waterproof pu id card holder pvc Certificates pp card holder with colored polyester lanyard,/contact us by Wechatname:Sunny22345,$0.39-0.69,Min. order: 100 pieces
https://s.alicdn.com/@sc04/kf/H7b61ad110a83496d822ce2a129d29eb7J.jpg_300x300.jpg,https://img.alicdn.com/imgextra/i3/3028865584/O1CN01micZy61r7WfFIOiJy_!!3028865584.jpg,Polyester NYLON cordon silicon botella tour de cou badge retractable blank lanyard and lanyard ID card holder with printing logo,/contact us by Wechatname:Sunny22345,$0.19-0.69,Min. order: 200 pieces
https://s.alicdn.com/@sc04/kf/H640454d6c8424409b45678ef67574b146.jpg_300x300.jpg,https://img.alicdn.com/imgextra/i3/3028865584/O1CN01micZy61r7WfFIOiJy_!!3028865584.jpg,Custom logo badge reel id card holder lanyard,/contact us by Wechatname:Sunny22345,$0.18-0.42,Min. order: 100 pieces
https://s.alicdn.com/@sc04/kf/H9e88ac2f57d347c6bd05d9d3e550d160c.jpg_300x300.jpg,https://img.alicdn.com/imgextra/i3/3028865584/O1CN01micZy61r7WfFIOiJy_!!3028865584.jpg,Factory custom Cell Phone Neck Strap pvc Lanyard for ID Card DIY Lanyards Rope Mobile Accessories,/contact us by Wechatname:Sunny22345,$0.36-0.43,Min. order: 100 pieces
https://s.alicdn.com/@sc04/kf/H1178a4a6157447879965657251f391ddf.jpg_300x300.jpg,https://img.alicdn.com/imgextra/i3/3028865584/O1CN01micZy61r7WfFIOiJy_!!3028865584.jpg,Factory Customized Cheap Clear Plastic PVC Badge id Card Holder with Lanyard,/contact us by Wechatname:Sunny22345,$0.49-0.55,Min. order: 500 pieces
https://s.alicdn.com/@sc04/kf/H9daf62b9cb454c7d9322f14c51878e9cx.jpg_300x300.jpg,https://img.alicdn.com/imgextra/i3/3028865584/O1CN01micZy61r7WfFIOiJy_!!3028865584.jpg,High Quality Supplier Promotional Factory Direct Price Custom Polyester Lanyard Printing Lanyard Badge reel Lanyard,/contact us by Wechatname:Sunny22345,$0.18-0.35,Min. order: 100 pieces
https://s.alicdn.com/@sc04/kf/H46a3968ba060444281b50bad2af1a449d.jpg_300x300.jpg,https://img.alicdn.com/imgextra/i3/3028865584/O1CN01micZy61r7WfFIOiJy_!!3028865584.jpg,Custom Universal Lanyard Cell Phone Wrist Strap Neck Strap For ID Card Holder Camera Wallet Ropes,/contact us by Wechatname:Sunny22345,$0.08-0.35,Min. order: 500 pieces
https://s.alicdn.com/@sc04/kf/Hc865e144da954fc0b1aafaa3d5c050cfR.jpg_300x300.jpg,https://img.alicdn.com/imgextra/i3/3028865584/O1CN01micZy61r7WfFIOiJy_!!3028865584.jpg,LED Id Card Holder flat optical fiber certificate promotion brand name card name tag badge KTV BAR exhibition LED lanyard,/contact us by Wechatname:Sunny22345,$1.28,Min. order: 20 pieces
https://s.alicdn.com/@sc04/kf/Hf35a95e4b5414b0e895051d0c1c55ed0k.jpg_300x300.jpg,https://img.alicdn.com/imgextra/i3/3028865584/O1CN01micZy61r7WfFIOiJy_!!3028865584.jpg,Custom Waterproof Plastic Badge Card Exhibition promotion Working Permit Buckle Neck strap Polyester Lanyard,/contact us by Wechatname:Sunny22345,$0.80,Min. order: 100 sets
https://s.alicdn.com/@sc04/kf/He1ffe77a804b4d54993b55d342ad5640z.jpg_300x300.jpg,https://img.alicdn.com/imgextra/i3/3028865584/O1CN01micZy61r7WfFIOiJy_!!3028865584.jpg,Neck Strap Lanyard Sling Id Badge Holders/Landyard And Pvc Name Card Polyester Lanyard Keychain,/contact us by Wechatname:Sunny22345,$0.05-0.30,Min. order: 100 pieces
https://s.alicdn.com/@sc04/kf/HTB1TMB4agaH3KVjSZFjq6AFWpXaA.jpg_300x300.jpg,https://img.alicdn.com/imgextra/i3/3028865584/O1CN01micZy61r7WfFIOiJy_!!3028865584.jpg,2019 Custom high quality led lanyard light up lanyard,/contact us by Wechatname:Sunny22345,$0.09-0.66,Min. order: 100 pieces
https://s.alicdn.com/@sc04/kf/HTB143RsbzzuK1RjSsppq6xz0XXaE.jpg_300x300.jpg,https://img.alicdn.com/imgextra/i3/3028865584/O1CN01micZy61r7WfFIOiJy_!!3028865584.jpg,Twister Lanyard with button badge,/contact us by Wechatname:Sunny22345,$0.22-0.49,"Min. order: 1,000 pieces"
https://s.alicdn.com/@sc04/kf/HTB1rWzpavfsK1RjSszbq6AqBXXa3.jpg_300x300.jpg,https://img.alicdn.com/imgextra/i3/3028865584/O1CN01micZy61r7WfFIOiJy_!!3028865584.jpg,Solid Color Nurse Mobile Phone Case Lanyard In Green Printed Wholesale Heat Press Cellphone Thick Lanyards With Pockets,/contact us by Wechatname:Sunny22345,$0.12-0.80,Min. order: 100 pieces
https://s.alicdn.com/@sc04/kf/Hbe502abf31b14389935873123eed19c0A.jpg_300x300.jpg,https://img.alicdn.com/imgextra/i3/3028865584/O1CN01micZy61r7WfFIOiJy_!!3028865584.jpg,Factory direct sales polyester lanyard custom multi-color sublimation transfer logo mobile phone key work ID lanyard,/contact us by Wechatname:Sunny22345,$0.20-0.44,Min. order: 300 pieces
https://s.alicdn.com/@sc04/kf/HTB10Uu6X6zuK1Rjy0Fpq6yEpFXaB.jpg_300x300.jpg,https://img.alicdn.com/imgextra/i3/3028865584/O1CN01micZy61r7WfFIOiJy_!!3028865584.jpg,Fashion mesh crystal lanyards with pvc card holder,/contact us by Wechatname:Sunny22345,$0.20-0.41,Min. order: 100 pieces
https://s.alicdn.com/@sc04/kf/HTB1A2jOt7UmBKNjSZFOq6yb2XXaY.jpg_300x300.jpg,https://img.alicdn.com/imgextra/i3/3028865584/O1CN01micZy61r7WfFIOiJy_!!3028865584.jpg,NFL Cheap Sublimation Printing Lanyard with PVC Soft Card Holder,/contact us by Wechatname:Sunny22345,$0.15-0.30,Min. order: 100 pieces
https://s.alicdn.com/@sc04/kf/H89372cd8c5c144cb86ad5661bcc2ad92T.jpg_300x300.jpg,https://img.alicdn.com/imgextra/i3/3028865584/O1CN01micZy61r7WfFIOiJy_!!3028865584.jpg,Wholesale safety woven neck lanyard Strap with PVC ID card Badge Holder,/contact us by Wechatname:Sunny22345,$0.10-0.60,Min. order: 1 piece
https://s.alicdn.com/@sc04/kf/HTB1emLAkMDD8KJjy0Fdq6AjvXXab.jpg_300x300.jpg,https://img.alicdn.com/imgextra/i3/3028865584/O1CN01micZy61r7WfFIOiJy_!!3028865584.jpg,2024 Cheap Heat Transfer Printing Retractable Badge Reel Lanyard With Pvc Plastic Clip,/contact us by Wechatname:Sunny22345,$0.05-0.35,Min. order: 100 pieces
https://s.alicdn.com/@sc04/kf/HTB1tmtqKxWYBuNjy1zkq6xGGpXaq.jpg_300x300.jpg,https://img.alicdn.com/imgextra/i3/3028865584/O1CN01micZy61r7WfFIOiJy_!!3028865584.jpg,AI-MICH Neck Strap Lanyard Sling Id Badge Holders/Landyard And Pvc Name Card Polyester Lanyard Keychain,/contact us by Wechatname:Sunny22345,$0.16-0.20,Min. order: 100 pieces
https://s.alicdn.com/@sc04/kf/HTB1_KOUXiDxK1RjSsphq6zHrpXaP.jpg_300x300.jpg,https://img.alicdn.com/imgextra/i3/3028865584/O1CN01micZy61r7WfFIOiJy_!!3028865584.jpg,Applicable to the event exhibition company soft PVC double-sided employee ID card with lanyard card holder,/contact us by Wechatname:Sunny22345,$0.04-0.10,Min. order: 100 pieces
https://s.alicdn.com/@sc04/kf/Haca83bda4d254ad784f05c724769a936H.png_300x300.png,https://img.alicdn.com/imgextra/i3/3028865584/O1CN01micZy61r7WfFIOiJy_!!3028865584.jpg,Fast Shipping Phone Keychain Polyester Lanyard Sports Medal Custom Lanyard Sublimation Printed Lanyards with Logo Custom,/contact us by Wechatname:Sunny22345,$0.12-0.35,Min. order: 50 pieces
https://s.alicdn.com/@sc04/kf/HTB1jpWlkkZmBKNjSZPiq6xFNVXaR.jpg_300x300.jpg,https://img.alicdn.com/imgextra/i3/3028865584/O1CN01micZy61r7WfFIOiJy_!!3028865584.jpg,plastic zipper lanyard 0.5cm/1cm width with logo customized,/contact us by Wechatname:Sunny22345,$0.35-0.60,"Min. order: 1,000 pieces"
https://s.alicdn.com/@sc04/kf/HTB1G3gDmL9TBuNjy0Fcq6zeiFXaV.jpg_300x300.jpg,https://img.alicdn.com/imgextra/i3/3028865584/O1CN01micZy61r7WfFIOiJy_!!3028865584.jpg,Personalized Popular Lanyard With Cup Holder,/contact us by Wechatname:Sunny22345,$0.21,"Min. order: 10,000 pieces"
https://s.alicdn.com/@sc04/kf/H31ab30f208bd4c438fafd1517b67c7fep.jpg_300x300.jpg,https://img.alicdn.com/imgextra/i3/3028865584/O1CN01micZy61r7WfFIOiJy_!!3028865584.jpg,Custom Soft Pvc Rubber 2D 3D logo Label Zipper Lanyard With Puller,/contact us by Wechatname:Sunny22345,$0.20-0.40,Min. order: 500 pieces
https://s.alicdn.com/@sc04/kf/HTB1cWPOXzDuK1Rjy1zjq6zraFXa6.jpg_300x300.jpg,https://img.alicdn.com/imgextra/i3/3028865584/O1CN01micZy61r7WfFIOiJy_!!3028865584.jpg,"Funny Zip Lanyard,zip Neck Strap",/contact us by Wechatname:Sunny22345,$0.24,"Min. order: 1,000 pieces"
https://s.alicdn.com/@sc04/kf/H491aa5d0063c42bebb3233da8f3575bds.jpg_300x300.jpg,https://img.alicdn.com/imgextra/i3/3028865584/O1CN01micZy61r7WfFIOiJy_!!3028865584.jpg,High quality custom ID Case Name Badge PVC Card Holder Polyester Lanyard with Logo Design,/contact us by Wechatname:Sunny22345,$0.76-0.82,Min. order: 1 piece
