image_url1,image_url2,product_name,contact,price,MOQ
https://s.alicdn.com/@sc04/kf/H153dec25d791478e9ef6cff21f93d2a0f.jpg,https://img.alicdn.com/imgextra/i2/3028865584/O1CN01IwkAMF1r7WfFrFpTJ_!!3028865584.jpg,No Minimum Order Manufacturer Cheap Personalized Neck Tool Printing Polyester Sublimation Custom Lanyards With Logo Custom,/contact us by Wechatname:Sunny22345,$0.08-0.20,"Min. order: 100 pieces Lanyards392,840 sold"
https://s.alicdn.com/@sc04/kf/H9ce540b4c2fd4fcb9b2223fd2d1fc6e9H.png,https://img.alicdn.com/imgextra/i2/3028865584/O1CN01IwkAMF1r7WfFrFpTJ_!!3028865584.jpg,Polyester Lanyard Wholesale Neck Lanyard Strap Custom Logo Lanyard,/contact us by Wechatname:Sunny22345,$0.15-0.17,"Min. order: 2,000 pieces Lanyard255,200 sold"
https://s.alicdn.com/@sc04/kf/He81ca0c151b64b38bf5292f04a7f1ad7K.jpg,https://img.alicdn.com/imgextra/i2/3028865584/O1CN01IwkAMF1r7WfFrFpTJ_!!3028865584.jpg,No Minimum Order Manufacturer Cheap Personalized Neck Tool Printing Polyester Sublimation Custom Lanyards With Logo Custom,/contact us by Wechatname:Sunny22345,$0.08-0.25,"Min. order: 100 pieces Lanyards167,278 sold"
https://s.alicdn.com/@sc04/kf/H68365248c6cb4e79be12963a4310b7caB.jpg,https://img.alicdn.com/imgextra/i2/3028865584/O1CN01IwkAMF1r7WfFrFpTJ_!!3028865584.jpg,Custom Breakaway Sublimation Lanyard Designer Printing Polyester Lanyard Neck Strap with Logo,/contact us by Wechatname:Sunny22345,$0.09-0.20,"Min. order: 100 pieces Lanyard93,605 sold"
https://s.alicdn.com/@sc04/kf/Hcf1cbb4388e44859bc2a50a46544a5a4D.png,https://img.alicdn.com/imgextra/i2/3028865584/O1CN01IwkAMF1r7WfFrFpTJ_!!3028865584.jpg,10mm 15mm 20mm 25mm 30mm rope lanyard for id card,/contact us by Wechatname:Sunny22345,$0.04-0.06,"Min. order: 99,999 meters lanyard86,000 sold"
https://s.alicdn.com/@sc04/kf/H8e48d4896fc541f8b93037171a0c61e23.jpg,https://img.alicdn.com/imgextra/i2/3028865584/O1CN01IwkAMF1r7WfFrFpTJ_!!3028865584.jpg,Custom Breakaway Sublimation Keychain Lanyards With Logo Custom Polyester Lanyard,/contact us by Wechatname:Sunny22345,$0.06-0.28,"Min. order: 50 pieces Lanyards80,903 sold"
https://s.alicdn.com/@sc04/kf/Hf6f31c6524ad4bf8b60c8a4baf407b68V.png,https://img.alicdn.com/imgextra/i2/3028865584/O1CN01IwkAMF1r7WfFrFpTJ_!!3028865584.jpg,Free Sample No Minimum Order Custom Printed Sublimation Neck Lanyards With Logo Custom Keychain Polyester Lanyard,/contact us by Wechatname:Sunny22345,$0.07-0.30,"Min. order: 2 pieces Lanyards67,747 sold"
https://s.alicdn.com/@sc04/kf/H4cd4ac0d71324735bef12c82310c8be06.jpg,https://img.alicdn.com/imgextra/i2/3028865584/O1CN01IwkAMF1r7WfFrFpTJ_!!3028865584.jpg,"Low Minimum Order Custom Printed Lanyard, Cheapest Lanyard With id Holder & Card, Completely Customize your Own Key Lanyard",/contact us by Wechatname:Sunny22345,$0.12-0.30,"Min. order: 100 pieces Lanyard65,846 sold"
https://s.alicdn.com/@sc04/kf/HTB1vVAiacrrK1RjSspaq6AREXXaJ.jpg,https://img.alicdn.com/imgextra/i2/3028865584/O1CN01IwkAMF1r7WfFrFpTJ_!!3028865584.jpg,AI-MICH Promotional Custom Logo Printed Lanyard Badge Reel Retractable Lanyard,/contact us by Wechatname:Sunny22345,$0.20-0.32,"Min. order: 100 pieces Lanyard55,001 sold"
https://s.alicdn.com/@sc04/kf/A81244adb12644098a67e9e0285befdc3c.jpg,https://img.alicdn.com/imgextra/i2/3028865584/O1CN01IwkAMF1r7WfFrFpTJ_!!3028865584.jpg,Factory wholesale hot selling polyester lanyard logo custom neck strap keychain lanyard custom keychain lanyard,/contact us by Wechatname:Sunny22345,$0.15-0.23,"Min. order: 100 pieces lanyard51,000 sold"
https://s.alicdn.com/@sc04/kf/Hd70079c91517496db2149542fe7f4a1bS.jpg,https://img.alicdn.com/imgextra/i2/3028865584/O1CN01IwkAMF1r7WfFrFpTJ_!!3028865584.jpg,Zhongshan promotional custom printed neck polyester lanyard with logo free sample,/contact us by Wechatname:Sunny22345,$0.15-0.25,"Min. order: 100 pieces lanyard48,514 sold"
https://s.alicdn.com/@sc04/kf/H702e7efc839442dab72484e936300457k.jpeg,https://img.alicdn.com/imgextra/i2/3028865584/O1CN01IwkAMF1r7WfFrFpTJ_!!3028865584.jpg,Promotional Custom Custom Lanyard With Logo Eco Sublimation Printing Nylon Polyester Id Card Holder Lanyards With Logo Custom,/contact us by Wechatname:Sunny22345,$0.12-0.78,"Min. order: 100 pieces Lanyard40,047 sold"
https://s.alicdn.com/@sc04/kf/Hc243224c6ca14c13adbaabe373d9f467u.jpg,https://img.alicdn.com/imgextra/i2/3028865584/O1CN01IwkAMF1r7WfFrFpTJ_!!3028865584.jpg,Custom printed neck sublimation lanyards for id badges landyard with logo,/contact us by Wechatname:Sunny22345,$0.05-0.20,"Min. order: 100 pieces lanyards34,100 sold"
https://s.alicdn.com/@sc04/kf/H563da1c32b8e481981eb5153f6a6b668K.jpg,https://img.alicdn.com/imgextra/i2/3028865584/O1CN01IwkAMF1r7WfFrFpTJ_!!3028865584.jpg,Custom Logo Dye Sublimation Polyester Keychain Lanyard Wholesale Neck Lanyard Strap,/contact us by Wechatname:Sunny22345,$0.08-0.45,"Min. order: 100 pieces Lanyard32,258 sold"
https://s.alicdn.com/@sc04/kf/H5b57ec5300b34960bc4ecae58d198027l.jpg,https://img.alicdn.com/imgextra/i2/3028865584/O1CN01IwkAMF1r7WfFrFpTJ_!!3028865584.jpg,Printed Sublimation Blank Safety Custom Promotional Neck Lanyard With Logo Custom Design Id Card Holder Polyester Lanyard,/contact us by Wechatname:Sunny22345,$0.30,"Min. order: 100 pieces Lanyard31,528 sold"
https://s.alicdn.com/@sc04/kf/He4db76ffb2954cfbb87180b9ef1e7bf6o.png,https://img.alicdn.com/imgextra/i2/3028865584/O1CN01IwkAMF1r7WfFrFpTJ_!!3028865584.jpg,Factory Wholesale High Quality custom Polyester Lanyard With Woven Logo for Advertising,/contact us by Wechatname:Sunny22345,$0.25-0.30,"Min. order: 2 pieces Lanyard31,250 sold"
https://s.alicdn.com/@sc04/kf/H4e3cbb1beeb0473ca8ddfca9fee4ea2cR.jpg,https://img.alicdn.com/imgextra/i2/3028865584/O1CN01IwkAMF1r7WfFrFpTJ_!!3028865584.jpg,Personalized Custom Printing Logo Lanyard Sublimation Polyester Neck ID Lanyards With Logo Custom,/contact us by Wechatname:Sunny22345,$0.08-0.28,"Min. order: 100 pieces Lanyard28,825 sold"
https://s.alicdn.com/@sc04/kf/H424dbe5d57aa45bba94f95bfb9ee5081o.jpg,https://img.alicdn.com/imgextra/i2/3028865584/O1CN01IwkAMF1r7WfFrFpTJ_!!3028865584.jpg,China Manufacturer Custom Embroidery Lanyard Keychain Key Nylon Woven Polyester Blue Cute Cartoon Nurse Lanyard With Clip Logo,/contact us by Wechatname:Sunny22345,$0.18-0.48,"Min. order: 100 pieces Lanyard23,000 sold"
https://s.alicdn.com/@sc04/kf/H95a48d9e24c54a8c8418827b29aa6bd4s.jpeg,https://img.alicdn.com/imgextra/i2/3028865584/O1CN01IwkAMF1r7WfFrFpTJ_!!3028865584.jpg,Custom Bulk Printed Sublimation Logo Manufacturer Promotional Lanyard With Set Item,/contact us by Wechatname:Sunny22345,$0.19-0.25,"Min. order: 100 pieces Lanyard21,401 sold"
https://s.alicdn.com/@sc04/kf/H4d075313c0e14c3995f6bd84a904e7dey.jpg,https://img.alicdn.com/imgextra/i2/3028865584/O1CN01IwkAMF1r7WfFrFpTJ_!!3028865584.jpg,"Lanyard Adjustable Colorful Nylon Hand Wrist Straps for Telescope, Camera, Keys, Keychain, Phone, USB Flash Drive, Wallet and ID",/contact us by Wechatname:Sunny22345,$0.07-0.12,"Min. order: 2 pieces Lanyard20,351 sold"
https://s.alicdn.com/@sc04/kf/Hf1ecb727ec4a404db63a8fa4fc3421baS.jpg,https://img.alicdn.com/imgextra/i2/3028865584/O1CN01IwkAMF1r7WfFrFpTJ_!!3028865584.jpg,Factory Price Custom Design Lanyard Keychain Neck Strap Printed Sublimation Polyester Lanyards With Logo Custom,/contact us by Wechatname:Sunny22345,$0.08-0.20,"Min. order: 100 pieces Lanyard19,915 sold"
https://s.alicdn.com/@sc04/kf/H12b389febe3e4399a75946e551eb7abej.jpg,https://img.alicdn.com/imgextra/i2/3028865584/O1CN01IwkAMF1r7WfFrFpTJ_!!3028865584.jpg,Custom lanyards high quality polyester phone printed design sublimation woven wrist lanyard with logo custom strap keychain,/contact us by Wechatname:Sunny22345,$0.12-0.38,"Min. order: 50 pieces lanyards19,900 sold"
https://s.alicdn.com/@sc04/kf/HLB1bd.1jnZmx1VjSZFGq6yx2XXai.jpg,https://img.alicdn.com/imgextra/i2/3028865584/O1CN01IwkAMF1r7WfFrFpTJ_!!3028865584.jpg,High quality personalized custom polyester jacquard neck strap detachable logo silk woven embroidered lanyard with keyring,/contact us by Wechatname:Sunny22345,$0.14-0.35,"Min. order: 50 pieces lanyard19,366 sold"
https://s.alicdn.com/@sc04/kf/H47a8b73d94b941d498a779e311df7322f.jpg,https://img.alicdn.com/imgextra/i2/3028865584/O1CN01IwkAMF1r7WfFrFpTJ_!!3028865584.jpg,Polyester Lobster Hooks Neck Lanyards Black Plain Double Hook Keychain Lanyard With Logo Custom Double Lanyard,/contact us by Wechatname:Sunny22345,$0.15-0.35,"Min. order: 100 pieces Lanyards19,350 sold"
https://s.alicdn.com/@sc04/kf/HTB1A72ke21H3KVjSZFHq6zKppXaM.jpg,https://img.alicdn.com/imgextra/i2/3028865584/O1CN01IwkAMF1r7WfFrFpTJ_!!3028865584.jpg,Custom printing carabiner lanyard strap for keychain,/contact us by Wechatname:Sunny22345,$0.35,"Min. order: 500 pieces lanyard19,059 sold"
https://s.alicdn.com/@sc04/kf/H271f6ee8b7ca42d0a833866b609535dfm.jpg,https://img.alicdn.com/imgextra/i2/3028865584/O1CN01IwkAMF1r7WfFrFpTJ_!!3028865584.jpg,Bestom Id Card Holder Lanyards with Logo Design Custom Strong Id Badge Neck Lace,/contact us by Wechatname:Sunny22345,$0.30-0.45,"Min. order: 100 pieces Lanyards19,000 sold"
https://s.alicdn.com/@sc04/kf/H4f94832eb93d47c481742058c0c5c2d2P.jpg,https://img.alicdn.com/imgextra/i2/3028865584/O1CN01IwkAMF1r7WfFrFpTJ_!!3028865584.jpg,Free Sample Phone Patch Country Flag Custom Car Key Lanyards,/contact us by Wechatname:Sunny22345,$0.20-0.25,"Min. order: 100 units Lanyards16,357 sold"
https://s.alicdn.com/@sc04/kf/HLB13KAyUCzqK1RjSZPcq6zTepXaX.jpg,https://img.alicdn.com/imgextra/i2/3028865584/O1CN01IwkAMF1r7WfFrFpTJ_!!3028865584.jpg,"Dye lanyard custom transfer print neck lanyards no minimum order, cheap event lanyard with key chain",/contact us by Wechatname:Sunny22345,$0.10-0.60,"Min. order: 1 piece lanyard15,805 sold"
https://s.alicdn.com/@sc04/kf/Hbe80e6d5d0634044b5fc64eca1d9532dZ.jpg,https://img.alicdn.com/imgextra/i2/3028865584/O1CN01IwkAMF1r7WfFrFpTJ_!!3028865584.jpg,Custom Satin Woven Breakaway Sublimation Keychain Lanyards with Logo Custom Polyester Lanyard,/contact us by Wechatname:Sunny22345,$0.03-0.24,"Min. order: 100 pieces Lanyards14,750 sold"
https://s.alicdn.com/@sc04/kf/H1b4551f7618143438ecebe874226d593k.jpg,https://img.alicdn.com/imgextra/i2/3028865584/O1CN01IwkAMF1r7WfFrFpTJ_!!3028865584.jpg,High quality hollow silk screen printed metal clip nylon lanyard with metal ID clip,/contact us by Wechatname:Sunny22345,$0.05-0.07,"Min. order: 1,000 pieces lanyard14,000 sold"
https://s.alicdn.com/@sc04/kf/Hdf81dbea21034236be71b5fe08cce29aJ.jpg,https://img.alicdn.com/imgextra/i2/3028865584/O1CN01IwkAMF1r7WfFrFpTJ_!!3028865584.jpg,Flat Polyester Cheap Personalize Single Custom Sublimation Lanyards With Logo,/contact us by Wechatname:Sunny22345,$0.29-0.65,"Min. order: 200 pieces Lanyards11,950 sold"
https://s.alicdn.com/@sc04/kf/H858d07ad1c7143a99571aefa993400107.jpg,https://img.alicdn.com/imgextra/i2/3028865584/O1CN01IwkAMF1r7WfFrFpTJ_!!3028865584.jpg,FREE Design Sublimation Polyester Lanyards with Logo Custom Neck Lanyard Strap With Safety ID Badge Holder Keychain Lanyard,/contact us by Wechatname:Sunny22345,$0.10-0.25,"Min. order: 100 pieces Lanyards11,635 sold"
https://s.alicdn.com/@sc04/kf/Hc35baf90e11a4cca8879438b029b73809.jpg,https://img.alicdn.com/imgextra/i2/3028865584/O1CN01IwkAMF1r7WfFrFpTJ_!!3028865584.jpg,No Minimum Order Custom Nylon Polyester Print Keychain Neck Strap Medal Sublimated Card Holder Lanyard With Logo Custom,/contact us by Wechatname:Sunny22345,$0.42,"Min. order: 10 pieces Lanyard11,573 sold"
https://s.alicdn.com/@sc04/kf/Had312382158944b481cd9eef1b5a3028m.jpg,https://img.alicdn.com/imgextra/i2/3028865584/O1CN01IwkAMF1r7WfFrFpTJ_!!3028865584.jpg,Custom Lanyards Quick Release Polyester Strap Lanyard Detachable Neck Lanyard with Clip,/contact us by Wechatname:Sunny22345,$0.21-0.32,"Min. order: 500 pieces Lanyards10,700 sold"
https://s.alicdn.com/@sc04/kf/Ha2b9924795444d20833cb852b9d90652x.jpg,https://img.alicdn.com/imgextra/i2/3028865584/O1CN01IwkAMF1r7WfFrFpTJ_!!3028865584.jpg,Promotion Anime Polyester Lanyard With id Card Badge Holder teacher Cell Mobile Phone Lanyards With Logo Custom Lanyard keychain,/contact us by Wechatname:Sunny22345,$0.08-0.12,"Min. order: 50 pieces Lanyard10,310 sold"
https://s.alicdn.com/@sc04/kf/H64d14eb0f5284b4f8ec8ae444104fae42.jpg,https://img.alicdn.com/imgextra/i2/3028865584/O1CN01IwkAMF1r7WfFrFpTJ_!!3028865584.jpg,Manufacturer Personalized Custom Design Lanyard Polyester Lanyards With Logo Custom High Quality,/contact us by Wechatname:Sunny22345,$0.05-0.25,"Min. order: 50 pieces Lanyard10,040 sold"
https://s.alicdn.com/@sc04/kf/Hda28f82b304549d5a55774bb82379c7cY.jpg,https://img.alicdn.com/imgextra/i2/3028865584/O1CN01IwkAMF1r7WfFrFpTJ_!!3028865584.jpg,Custom Printed Polyester Lanyard Neck Strap With Safety Buckle School Key Lanyard,/contact us by Wechatname:Sunny22345,$0.09-0.75,"Min. order: 50 pieces Lanyard10,000 sold"
https://s.alicdn.com/@sc04/kf/Ha5fe5b47eba54d829883138ec52e4d73u.jpg,https://img.alicdn.com/imgextra/i2/3028865584/O1CN01IwkAMF1r7WfFrFpTJ_!!3028865584.jpg,Custom nylon polyester personalised laynards print keychain neck strap medal sublimated card holder lanyard with logo custom,/contact us by Wechatname:Sunny22345,$0.15-0.35,"Min. order: 100 pieces lanyard9,317 sold"
https://s.alicdn.com/@sc04/kf/Hf99adc4562924d079d7ee21b5eaf9fb2T.jpg,https://img.alicdn.com/imgextra/i2/3028865584/O1CN01IwkAMF1r7WfFrFpTJ_!!3028865584.jpg,customized conference works sublimation lanyard,/contact us by Wechatname:Sunny22345,$0.15-0.50,"Min. order: 100 pieces lanyard8,510 sold"
https://s.alicdn.com/@sc04/kf/H7956009019f94f3e9e2e7b9415276e68Y.jpg,https://img.alicdn.com/imgextra/i2/3028865584/O1CN01IwkAMF1r7WfFrFpTJ_!!3028865584.jpg,Custom Heat Transfer Printing Colorful LOGO Polyester Lanyard Event Supplies Custom Lanyard,/contact us by Wechatname:Sunny22345,$0.21-0.25,"Min. order: 100 pieces Lanyard8,400 sold"
https://s.alicdn.com/@sc04/kf/Ha6e81c600c1442b6a7bd0d1d8325b96cO.jpg,https://img.alicdn.com/imgextra/i2/3028865584/O1CN01IwkAMF1r7WfFrFpTJ_!!3028865584.jpg,1 Custom Sublimation Satin Polyester Logo Wrist Lanyard Strap with Animated id Card Badge Holder Accessories for Promotion,/contact us by Wechatname:Sunny22345,$0.15-0.30,"Min. order: 100 pieces Lanyard8,350 sold"
https://s.alicdn.com/@sc04/kf/H38c30dcfc44044c6860b14b8a23a204aS.jpg,https://img.alicdn.com/imgextra/i2/3028865584/O1CN01IwkAMF1r7WfFrFpTJ_!!3028865584.jpg,Hot Sale Custom Logo Fashion Lanyard Plain Black Polyester Silk Screen Digital Offset Printing Featuring Stylish Hook Accessory,/contact us by Wechatname:Sunny22345,$0.19-0.25,"Min. order: 100 pieces Lanyard7,700 sold"
https://s.alicdn.com/@sc04/kf/H124c9005c11f4870a60f376160258a3e5.jpg,https://img.alicdn.com/imgextra/i2/3028865584/O1CN01IwkAMF1r7WfFrFpTJ_!!3028865584.jpg,OEM UHOO high quality multicolor 15mm width lanyard with current ready stock Lanyard custom logo,/contact us by Wechatname:Sunny22345,$0.12-0.20,"Min. order: 360 pieces lanyard7,231 sold"
https://s.alicdn.com/@sc04/kf/H1b413eb2baab4e059bd79b188a3d0aa5F.png,https://img.alicdn.com/imgextra/i2/3028865584/O1CN01IwkAMF1r7WfFrFpTJ_!!3028865584.jpg,Heatpress Printing High Quality Low Price Flap Ribbon Neck Strap Stitch Keychain Lanyard With Custom Logo,/contact us by Wechatname:Sunny22345,$0.10-0.30,"Min. order: 100 pieces Lanyard7,001 sold"
https://s.alicdn.com/@sc04/kf/H543ea1b252e5483f8f8191623e6163c7h.jpg,https://img.alicdn.com/imgextra/i2/3028865584/O1CN01IwkAMF1r7WfFrFpTJ_!!3028865584.jpg,Wholesalers Custom Design Neck ID Card Badge Holder Polyester Nylon Woven Sublimation Printed Logo Lanyards With Logo Custom,/contact us by Wechatname:Sunny22345,$0.18-0.35,"Min. order: 100 pieces Lanyards6,932 sold"
https://s.alicdn.com/@sc04/kf/H2fa67086386b4a258b8e2e13dea83f37m.jpg,https://img.alicdn.com/imgextra/i2/3028865584/O1CN01IwkAMF1r7WfFrFpTJ_!!3028865584.jpg,Custom Sublimation Printed Logo Polyester Lanyard ID Card Holder Neck Lanyard Strap with Logo Custom,/contact us by Wechatname:Sunny22345,$0.30 ,"Min. order: 100 pieces Lanyard6,273 sold"
https://s.alicdn.com/@sc04/kf/Hccab4667b2a64240a2f5a61af0b2de2e5.jpg,https://img.alicdn.com/imgextra/i2/3028865584/O1CN01IwkAMF1r7WfFrFpTJ_!!3028865584.jpg,High Quality lanyard plastic hook Free Sample Lanyards With Logo Custom,/contact us by Wechatname:Sunny22345,$0.09-0.25,"Min. order: 100 pieces lanyard6,000 sold"
https://s.alicdn.com/@sc04/kf/HTB1WGcLEGmWBuNjy1Xaq6xCbXXa8.jpg,https://img.alicdn.com/imgextra/i2/3028865584/O1CN01IwkAMF1r7WfFrFpTJ_!!3028865584.jpg,Supplier Cheap Custom Smooth Sublimation Printed Lanyard with your logo,/contact us by Wechatname:Sunny22345,$0.66,"Min. order: 1,000 pieces Lanyard6,000 sold"
https://s.alicdn.com/@sc04/kf/H60b1e863c8124b77a7a60a63be4ba8c4U.jpg,https://img.alicdn.com/imgextra/i2/3028865584/O1CN01IwkAMF1r7WfFrFpTJ_!!3028865584.jpg,Different Country Flag logo Lanyard Custom CMYK Sublimate 2 Side logo Lanyard Keychain,/contact us by Wechatname:Sunny22345,$0.12-0.28,"Min. order: 1,000 pieces Lanyard5,000 sold"
https://s.alicdn.com/@sc04/kf/Ha77eb321567b4b7bb138b27b092f6061y.jpg,https://img.alicdn.com/imgextra/i2/3028865584/O1CN01IwkAMF1r7WfFrFpTJ_!!3028865584.jpg,Customized Printed Polyester Neck Strap Lanyard,/contact us by Wechatname:Sunny22345,$0.16-0.20,"Min. order: 1,000 pieces Lanyard4,400 sold"
https://s.alicdn.com/@sc04/kf/A7bbb6a3944184634b8efe147f7fbf2c64.png,https://img.alicdn.com/imgextra/i2/3028865584/O1CN01IwkAMF1r7WfFrFpTJ_!!3028865584.jpg,Bestom Designer Woven Lanyards for Custom Logo Id Lace Polyester Name Badge Card Holder Factory Price,/contact us by Wechatname:Sunny22345,$0.30-0.45,"Min. order: 100 pieces Lanyards4,000 sold"
https://s.alicdn.com/@sc04/kf/Hf26388ce665848f58963415ca2b21010v.jpg,https://img.alicdn.com/imgextra/i2/3028865584/O1CN01IwkAMF1r7WfFrFpTJ_!!3028865584.jpg,Promotional Phone Id Card Keychain Printed Nylon Neck Strap Ribbon Anime Wrist Strap Polyester Lanyard With Logo Custom Lanyard,/contact us by Wechatname:Sunny22345,$0.07-0.24,"Min. order: 100 pieces Lanyard3,984 sold"
https://s.alicdn.com/@sc04/kf/H3b1e034d19724b9fbb87a071beb6e7c8P.jpg,https://img.alicdn.com/imgextra/i2/3028865584/O1CN01IwkAMF1r7WfFrFpTJ_!!3028865584.jpg,High Quality Neck Custom Polyester Pink Style Lanyards ID Card Keychain,/contact us by Wechatname:Sunny22345,$0.45-0.68,"Min. order: 50 pieces Lanyards3,460 sold"
https://s.alicdn.com/@sc04/kf/H8cf6a951531542e5bc42410782775719C.jpg,https://img.alicdn.com/imgextra/i2/3028865584/O1CN01IwkAMF1r7WfFrFpTJ_!!3028865584.jpg,Logo Custom Polyester Lanyard Custom Breakaway Sublimation Keychain Lanyards,/contact us by Wechatname:Sunny22345,$0.25-0.55,"Min. order: 100 pieces Lanyard3,251 sold"
https://s.alicdn.com/@sc04/kf/Hab305df16ea344fbad3acabeee9e91a9a.jpg,https://img.alicdn.com/imgextra/i2/3028865584/O1CN01IwkAMF1r7WfFrFpTJ_!!3028865584.jpg,Personalized Custom Mobile Phone Lanyard ID Card Holder Lanyard Work ID Hanging Rope Polyester Neck Lanyard,/contact us by Wechatname:Sunny22345,$0.16-0.22,"Min. order: 100 pieces Lanyard3,200 sold"
https://s.alicdn.com/@sc04/kf/He635bfc59a5540cbafe79babedee1af5p.jpg,https://img.alicdn.com/imgextra/i2/3028865584/O1CN01IwkAMF1r7WfFrFpTJ_!!3028865584.jpg,Customized Color Print Neck Lanyard Personalized Lanyards Fabric Lanyard For Event,/contact us by Wechatname:Sunny22345,$0.10-0.32,"Min. order: 100 pieces Lanyard2,800 sold"
https://s.alicdn.com/@sc04/kf/He750c92f115a4ca9bb82b3292a35e5fe0.png,https://img.alicdn.com/imgextra/i2/3028865584/O1CN01IwkAMF1r7WfFrFpTJ_!!3028865584.jpg,"Full Color Custom Lanyards with your name company, school logo, business, Keys & id holder Personalized Lanyard",/contact us by Wechatname:Sunny22345,$0.60-15.00,"Min. order: 2 pieces Lanyards2,780 sold"
https://s.alicdn.com/@sc04/kf/H204d98b8b3f047409b19c3064705b834b.jpg,https://img.alicdn.com/imgextra/i2/3028865584/O1CN01IwkAMF1r7WfFrFpTJ_!!3028865584.jpg,Special designer luxury blank printing single green custom neck lanyard,/contact us by Wechatname:Sunny22345,$0.15-0.85,"Min. order: 100 pieces lanyard2,700 sold"
https://s.alicdn.com/@sc04/kf/H3df966ba6af142b68925b2af7b1d69e25.jpg,https://img.alicdn.com/imgextra/i2/3028865584/O1CN01IwkAMF1r7WfFrFpTJ_!!3028865584.jpg,Custom Color Thermal Printed Heat Transfer Logo Polyester ID Badge Lanyard with Metal Swivel Hook and Plastic Detachable Buckle,/contact us by Wechatname:Sunny22345,$0.23-0.26,"Min. order: 100 pieces Lanyard2,604 sold"
https://s.alicdn.com/@sc04/kf/H0057b664ca384f07b248a1a15871210dM.jpg,https://img.alicdn.com/imgextra/i2/3028865584/O1CN01IwkAMF1r7WfFrFpTJ_!!3028865584.jpg,Buy It Now Durable Polyester Heat Transfer Print Neck Strap Personalized Custom Horror Lanyards,/contact us by Wechatname:Sunny22345,$0.60-0.80,"Min. order: 10 pieces Lanyards2,574 sold"
https://s.alicdn.com/@sc04/kf/H6f5409d834004066b084f24992253781F.png,https://img.alicdn.com/imgextra/i2/3028865584/O1CN01IwkAMF1r7WfFrFpTJ_!!3028865584.jpg,Custom Logo Flat Lanyard Polyester Lanyard lanyard red with logo,/contact us by Wechatname:Sunny22345,$0.05-0.50,"Min. order: 50 pieces Lanyard2,302 sold"
https://s.alicdn.com/@sc04/kf/H6d2f37d64c764188b7565bc192572687K.jpg,https://img.alicdn.com/imgextra/i2/3028865584/O1CN01IwkAMF1r7WfFrFpTJ_!!3028865584.jpg,Custom black gray rubber printing lanyard AIRBUS lanyard with mini seatbelt buckle,/contact us by Wechatname:Sunny22345,$3.85-5.00,"Min. order: 10 pieces lanyard2,219 sold"
https://s.alicdn.com/@sc04/kf/H3b9397b340cd469e968480ca96de12bcs.png,https://img.alicdn.com/imgextra/i2/3028865584/O1CN01IwkAMF1r7WfFrFpTJ_!!3028865584.jpg,OEM Cellphone Lanyard High Quality Lanyard Accept Custom logo for Football Sports Lanyard,/contact us by Wechatname:Sunny22345,$0.35-0.55,"Min. order: 5 pieces Lanyard2,137 sold"
https://s.alicdn.com/@sc04/kf/Ha3a4c17840c9474c92533aa6db58627ds.jpg,https://img.alicdn.com/imgextra/i2/3028865584/O1CN01IwkAMF1r7WfFrFpTJ_!!3028865584.jpg,High quality neck lace Printed Polyester Sublimation Breakaway Strap Vip pass badges For Custom Lanyards With Logo,/contact us by Wechatname:Sunny22345,$0.20,"Min. order: 100 pieces Lanyards2,027 sold"
https://s.alicdn.com/@sc04/kf/Hfaaef35e7f304eef87bd5c461a995c74M.jpg,https://img.alicdn.com/imgextra/i2/3028865584/O1CN01IwkAMF1r7WfFrFpTJ_!!3028865584.jpg,New Styles Grey's Anatomy Cartoon Doctor Nurse Neck Card Holder Strap Lanyard ID Holder Hang Rope Custom,/contact us by Wechatname:Sunny22345,$0.38-0.78,"Min. order: 50 pieces Lanyard2,020 sold"
https://s.alicdn.com/@sc04/kf/He41dc8ac909b4946bec3aa12618b6bb0X.jpg,https://img.alicdn.com/imgextra/i2/3028865584/O1CN01IwkAMF1r7WfFrFpTJ_!!3028865584.jpg,Factory Wholesale High Quality custom Polyester Lanyard With Woven Logo for Advertising,/contact us by Wechatname:Sunny22345,$0.25-0.30,"Min. order: 2 pieces Lanyard2,000 sold"
https://s.alicdn.com/@sc04/kf/He608b4cdb62243a79d742353a5349f3aq.jpg,https://img.alicdn.com/imgextra/i2/3028865584/O1CN01IwkAMF1r7WfFrFpTJ_!!3028865584.jpg,Custom High Quality Polyester Nylon Lanyard Featuring Digital Printing Silk Screen Offset Logo Hook Accessory Made Silicone,/contact us by Wechatname:Sunny22345,$0.20-0.45,"Min. order: 100 pieces Lanyard1,900 sold"
https://s.alicdn.com/@sc04/kf/H176a66e1ad2841fe8f7cf825af4a5eb9P.jpg,https://img.alicdn.com/imgextra/i2/3028865584/O1CN01IwkAMF1r7WfFrFpTJ_!!3028865584.jpg,Promotional Custom Printed Neck Polyester Lanyard With Logo Free Sample,/contact us by Wechatname:Sunny22345,$0.20-0.89,"Min. order: 100 pieces Lanyard1,640 sold"
https://s.alicdn.com/@sc04/kf/Hcc9fc0caca2246b79940b003c2c08924O.jpg,https://img.alicdn.com/imgextra/i2/3028865584/O1CN01IwkAMF1r7WfFrFpTJ_!!3028865584.jpg,2024 Factory Wholesale Blank Sublimation Promotional Custom Printed Neck Polyester Lanyard With logo Free Sample As a Gift,/contact us by Wechatname:Sunny22345,$0.08-0.25,"Min. order: 100 pieces Lanyard1,604 sold"
https://s.alicdn.com/@sc04/kf/HTB1nCEnktbJ8KJjy1zjq6yqapXaq.jpg,https://img.alicdn.com/imgextra/i2/3028865584/O1CN01IwkAMF1r7WfFrFpTJ_!!3028865584.jpg,2024 2025 Cheapest Polyester Sublimation Blank Lanyards for Hot Sale No MOQ,/contact us by Wechatname:Sunny22345,$0.05-0.35,"Min. order: 100 pieces Lanyards1,504 sold"
https://s.alicdn.com/@sc04/kf/H5aade803f2ff4441a073d985c4c579f5d.jpg,https://img.alicdn.com/imgextra/i2/3028865584/O1CN01IwkAMF1r7WfFrFpTJ_!!3028865584.jpg,Free Design Wholesale Custom Lanyards With Logo Custom Fabric Sublimation Polyester Lanyard Keychain Strap,/contact us by Wechatname:Sunny22345,$0.50,"Min. order: 100 pieces Lanyards1,500 sold"
https://s.alicdn.com/@sc04/kf/Hd0c09595421f4c16b4028b149bc2c1a2J.jpg,https://img.alicdn.com/imgextra/i2/3028865584/O1CN01IwkAMF1r7WfFrFpTJ_!!3028865584.jpg,Custom Polyester Lanyards Full Color Printing Neck Straps with Logo Custom Keychain with Card Holder,/contact us by Wechatname:Sunny22345,$0.60,"Min. order: 100 pieces Lanyards1,500 sold"
https://s.alicdn.com/@sc04/kf/Hb09440ec300243cdbd0bf65de9171732E.jpg,https://img.alicdn.com/imgextra/i2/3028865584/O1CN01IwkAMF1r7WfFrFpTJ_!!3028865584.jpg,promotional custom printed neck polyester lanyard with logo free sample,/contact us by Wechatname:Sunny22345,$0.25-0.60,"Min. order: 100 pieces lanyard1,452 sold"
https://s.alicdn.com/@sc04/kf/H53829eff77ec4fb9a29d812cca8d2193H.jpg,https://img.alicdn.com/imgextra/i2/3028865584/O1CN01IwkAMF1r7WfFrFpTJ_!!3028865584.jpg,Polyester Silk Screen Printing Lanyard With Safety Breakaway Love Pink Lanyards Logo Id Badge Holder Love Pink Lanyard Keychain,/contact us by Wechatname:Sunny22345,$0.50,"Min. order: 10 pieces Lanyard1,425 sold"
https://s.alicdn.com/@sc04/kf/H60f5889dd134464495c13b295ef02cd2S.jpeg,https://img.alicdn.com/imgextra/i2/3028865584/O1CN01IwkAMF1r7WfFrFpTJ_!!3028865584.jpg,Customized Personalized Logo Neck Strap Sublimation Printed Lanyard Custom Made Polyester Cheap Lanyard Waterproof Lanyard,/contact us by Wechatname:Sunny22345,$0.14-0.24,"Min. order: 100 pieces Lanyard1,362 sold"
