image_url1,image_url2,product_name,contact,price,MOQ
https://s.alicdn.com/@sc04/kf/H6f228aba8ba647d49ce9a22f44d01acbl.jpg_300x300.jpg,https://img.alicdn.com/imgextra/i3/3028865584/O1CN01micZy61r7WfFIOiJy_!!3028865584.jpg,wholesale cell phone lanyard adjustable nylon neck strap crossbody mobile phone lanyard,/contact us by Wechatname:Sunny22345,$0.39-0.69,Min. order: 50 pieces
https://s.alicdn.com/@sc04/kf/H8b7d8f79f22249498225e86040acd15de.jpg_300x300.jpg,https://img.alicdn.com/imgextra/i3/3028865584/O1CN01micZy61r7WfFIOiJy_!!3028865584.jpg,14 Styles New Hazbin Hotel Neck Strap Card Holder Bag Anime Phone Strap Lanyard wholesale,/contact us by Wechatname:Sunny22345,$0.99-1.49,Min. order: 50 pieces
https://s.alicdn.com/@sc04/kf/Hf53e75503e5f437eb830aa71460ec693V.jpg_300x300.jpg,https://img.alicdn.com/imgextra/i3/3028865584/O1CN01micZy61r7WfFIOiJy_!!3028865584.jpg,Reasonable Price Lanyard Polyester Custom Lanyards With logo Phone Strap Printing Machine Sublimation,/contact us by Wechatname:Sunny22345,$0.43-1.15,Min. order: 50 pieces
https://s.alicdn.com/@sc04/kf/H24744c38590a46edad1da0d39c06a71eU.jpg_300x300.jpg,https://img.alicdn.com/imgextra/i3/3028865584/O1CN01micZy61r7WfFIOiJy_!!3028865584.jpg,Outdoor Lanyard Phone Strap Braided Nylon Rope Keychain Key Ring Braided Strips Keycord Hanging Trousers Accessories,/contact us by Wechatname:Sunny22345,$0.45-0.65,Min. order: 50 pieces
https://s.alicdn.com/@sc04/kf/H5cd8a63ebc2c46629095c52c48cfe9089.jpg_300x300.jpg,https://img.alicdn.com/imgextra/i3/3028865584/O1CN01micZy61r7WfFIOiJy_!!3028865584.jpg,Anime Cartoon Mobile Phone Neck Hanging Rope Polyester Heat Transfer Printing Ribbon Wholesale Cartoon Stitch Portable Lanyards,/contact us by Wechatname:Sunny22345,$0.45-0.55,Min. order: 50 pieces
https://s.alicdn.com/@sc04/kf/Hccc0e886bf6c415bbbc994ddf49401de8.jpg_300x300.jpg,https://img.alicdn.com/imgextra/i3/3028865584/O1CN01micZy61r7WfFIOiJy_!!3028865584.jpg,Reflective Nylon Wrist Lanyard Keychain Sports Adjustable Hand Strap Lanyards For Key Flashlight Water Cup Usb Camera Cell Phone,/contact us by Wechatname:Sunny22345,$0.30,Min. order: 50 pieces
https://s.alicdn.com/@sc04/kf/Hf01fde03b9c74105ac97effb352b99475.jpg_300x300.jpg,https://img.alicdn.com/imgextra/i3/3028865584/O1CN01micZy61r7WfFIOiJy_!!3028865584.jpg,Pink Strawberry Bear Cartoon Mobile Phone Lanyard Women's Neck Long and Short Chain Wrist Lanyard Pendant Key Lanyard,/contact us by Wechatname:Sunny22345,$0.42,Min. order: 50 pieces
https://s.alicdn.com/@sc04/kf/H01484db4665e4837889c7edc8f6cae4bn.jpg_300x300.jpg,https://img.alicdn.com/imgextra/i3/3028865584/O1CN01micZy61r7WfFIOiJy_!!3028865584.jpg,Custom Logo Nylon Water Bottle Shoulder Strap Adjustable Sports Water Bottle Holder Strap Portable Travel Cup Lanyard,/contact us by Wechatname:Sunny22345,$0.50-0.65,Min. order: 50 pieces
https://s.alicdn.com/@sc04/kf/H9b0c66a36e554cecbdea5d1b3b9dbd2cB.jpg_300x300.jpg,https://img.alicdn.com/imgextra/i3/3028865584/O1CN01micZy61r7WfFIOiJy_!!3028865584.jpg,Fast Cheap Custom Tag Lanyards Vendors Anime Bulk Personalizzato Sublimation Sports Anime Wrist Lanyard,/contact us by Wechatname:Sunny22345,$0.31,Min. order: 50 pieces
https://s.alicdn.com/@sc04/kf/H9b6b3b2cf56c4ec0b67454c95b99a235b.jpg_300x300.jpg,https://img.alicdn.com/imgextra/i3/3028865584/O1CN01micZy61r7WfFIOiJy_!!3028865584.jpg,Wholesale OEM Blank Sublimation Polyester Nylon Plain Cheap Personalized Custom Logo Printed Lanyard,/contact us by Wechatname:Sunny22345,$0.20-0.50,Min. order: 50 pieces
https://s.alicdn.com/@sc04/kf/H8549c534b6774cdfbc1eb666b6db2cadp.jpg_300x300.jpg,https://img.alicdn.com/imgextra/i3/3028865584/O1CN01micZy61r7WfFIOiJy_!!3028865584.jpg,Free Shipping Factory Price Custom Fashion Nylon Phone Keyring Hot Selling Anime Demon Slayer Lanyard,/contact us by Wechatname:Sunny22345,$1.50,Min. order: 50 pieces
https://s.alicdn.com/@sc04/kf/Hd9905e663d0845588c6ea959cc052429z.jpg_300x300.jpg,https://img.alicdn.com/imgextra/i3/3028865584/O1CN01micZy61r7WfFIOiJy_!!3028865584.jpg,Nylon Neck Chains Adjustable Straps Lanyard Sublimation Printed Logo Design Custom Lanyard,/contact us by Wechatname:Sunny22345,$0.90-1.50,Min. order: 50 pieces
https://s.alicdn.com/@sc04/kf/Hba65121f791b4fe380d3b90a6a5c360eS.jpg_300x300.jpg,https://img.alicdn.com/imgextra/i3/3028865584/O1CN01micZy61r7WfFIOiJy_!!3028865584.jpg,Factory Custom White Black Lanyard Musical Note Lanyards for Badge Reel Id Card Holder,/contact us by Wechatname:Sunny22345,$0.38-0.79,Min. order: 50 pieces
https://s.alicdn.com/@sc04/kf/Hedcdd3781b22486f91933a6872d022aew.jpg_300x300.jpg,https://img.alicdn.com/imgextra/i3/3028865584/O1CN01micZy61r7WfFIOiJy_!!3028865584.jpg,"Wristlet Lanyard, Stretchy Keychain Holder, Original Elastic Anti-Drop Design",/contact us by Wechatname:Sunny22345,$1.38-1.50,Min. order: 50 pieces
https://s.alicdn.com/@sc04/kf/H2d2da70113634904a75e6e060f3b08f8V.jpg_300x300.jpg,https://img.alicdn.com/imgextra/i3/3028865584/O1CN01micZy61r7WfFIOiJy_!!3028865584.jpg,Yiwu Gillian Satin Ribbon Lanyard Girly Lanyards,/contact us by Wechatname:Sunny22345,$0.95-1.00,Min. order: 50 pieces
https://s.alicdn.com/@sc04/kf/Hd8facad30fa0442e8a9a26058cffdb44e.jpg_300x300.jpg,https://img.alicdn.com/imgextra/i3/3028865584/O1CN01micZy61r7WfFIOiJy_!!3028865584.jpg,Hot Selling Leather Strap With Custom Logo Dye Sublimation Polyester Leather Short Keychain Lanyard,/contact us by Wechatname:Sunny22345,$0.27-0.42,Min. order: 50 pieces
https://s.alicdn.com/@sc04/kf/H0ea2a7c4d50b4f6fbf6ca6e3372da9cb1.jpg_300x300.jpg,https://img.alicdn.com/imgextra/i3/3028865584/O1CN01micZy61r7WfFIOiJy_!!3028865584.jpg,2024 New Fashion Girls Outdoor Sports Mobile Phone Lanyard Strong and Durable with Short Wrist Rope made of Nylon,/contact us by Wechatname:Sunny22345,$1.00-1.20,Min. order: 50 pieces
https://s.alicdn.com/@sc04/kf/Hefd37a6a6d85461d91768e194574d559l.jpg_300x300.jpg,https://img.alicdn.com/imgextra/i3/3028865584/O1CN01micZy61r7WfFIOiJy_!!3028865584.jpg,Nylon Lanyards Multifunctional hiking buckle Mineral Water Beverage Bottle Strap Lanyard,/contact us by Wechatname:Sunny22345,$0.52-0.65,Min. order: 50 pieces
https://s.alicdn.com/@sc04/kf/H4fc8500ee0094a72b26a3b1c29bf5dcfA.jpg_300x300.jpg,https://img.alicdn.com/imgextra/i3/3028865584/O1CN01micZy61r7WfFIOiJy_!!3028865584.jpg,High Quality Nylon Reinforced Non-slip Elastic Adjustable Tool Safety Lanyard,/contact us by Wechatname:Sunny22345,$0.70-1.50,Min. order: 50 pieces
https://s.alicdn.com/@sc04/kf/Ha4a94e4a1d064141bb9eccaca8a412acN.jpg_300x300.jpg,https://img.alicdn.com/imgextra/i3/3028865584/O1CN01micZy61r7WfFIOiJy_!!3028865584.jpg,Cheap Custom Lanyards ID Card Badge Holder Neck Strap Printed Logo Dye Sublimation Polyester Woven Nylon Mobile Key Lanyard,/contact us by Wechatname:Sunny22345,$2.20-3.20,Min. order: 50 pieces
https://s.alicdn.com/@sc04/kf/Ha8878cfa9fa8493ab7fc9ec2e0e73c8ft.jpg_300x300.jpg,https://img.alicdn.com/imgextra/i3/3028865584/O1CN01micZy61r7WfFIOiJy_!!3028865584.jpg,Sublimation Polyester Logo PU Leather Connect Short Lanyard Key Chain Wrist Lanyard Keychain Lanyard for keys,/contact us by Wechatname:Sunny22345,$0.52-0.62,Min. order: 50 pieces
https://s.alicdn.com/@sc04/kf/H9fe23eece1114c4bb4d3b55e40245e9er.jpg_300x300.jpg,https://img.alicdn.com/imgextra/i3/3028865584/O1CN01micZy61r7WfFIOiJy_!!3028865584.jpg,KPOP RIIZE Laser Phone Lanyard Get A Guitar Album Keychain Accessories Bag strap ANTON SOHEE WONBIN EUNSEOK Fans Collection Gift,/contact us by Wechatname:Sunny22345,$0.77-0.82,Min. order: 50 pieces
https://s.alicdn.com/@sc04/kf/Hb0f5e90d3b62445caa75f49ddbe56f50K.jpg_300x300.jpg,https://img.alicdn.com/imgextra/i3/3028865584/O1CN01micZy61r7WfFIOiJy_!!3028865584.jpg,Promotional Lanyards Sublimation Mobile Phone Lanyard Custom Printed Id Card Holder Safety Polyester Lanyard With Custom Logo,/contact us by Wechatname:Sunny22345,$0.22-0.30,Min. order: 50 pieces
https://s.alicdn.com/@sc04/kf/H14e68e56c9114b93b62c571283217bb13.jpg_300x300.jpg,https://img.alicdn.com/imgextra/i3/3028865584/O1CN01micZy61r7WfFIOiJy_!!3028865584.jpg,High Quality Other Lanyards Mobile Phone Strap with Lanyard for Accessories,/contact us by Wechatname:Sunny22345,$0.08-0.10,Min. order: 50 pieces
https://s.alicdn.com/@sc04/kf/H2edd490efe13427cb79aca08e5b3c61ca.jpg_300x300.jpg,https://img.alicdn.com/imgextra/i3/3028865584/O1CN01micZy61r7WfFIOiJy_!!3028865584.jpg,Hot Seller Card Holder Butterfly Lanyard Anime Nylon Lanyard With ID Card Badge Holder In Stock,/contact us by Wechatname:Sunny22345,$0.80-1.20,Min. order: 50 pieces
https://s.alicdn.com/@sc04/kf/H1781cef01826435db0d5fdefe239a2a8O.jpg_300x300.jpg,https://img.alicdn.com/imgextra/i3/3028865584/O1CN01micZy61r7WfFIOiJy_!!3028865584.jpg,Manufacturer Led Luminous Bracelet Concert Bar Custom Logo LED Light Up Sports Wrist Strap Nylon Lanyard,/contact us by Wechatname:Sunny22345,$0.65-0.90,Min. order: 50 pieces
https://s.alicdn.com/@sc04/kf/H54663ab79b194ea4a1f2faefdf440b3a8.jpg_300x300.jpg,https://img.alicdn.com/imgextra/i3/3028865584/O1CN01micZy61r7WfFIOiJy_!!3028865584.jpg,High Quality Customized Retractable Nylon Strap Phone Teacher Lanyard Polyester Cheap Woven Lanyard,/contact us by Wechatname:Sunny22345,$0.49-0.68,Min. order: 50 pieces
https://s.alicdn.com/@sc04/kf/H7a73ebe56c8a41ab9709ada755006e42G.jpg_300x300.jpg,https://img.alicdn.com/imgextra/i3/3028865584/O1CN01micZy61r7WfFIOiJy_!!3028865584.jpg,Cheap Price Promotional Lanyard Polyester Blank Sublimation Lanyard Keychain with Custom Logo Lanyards with ID Card Badge Holder,/contact us by Wechatname:Sunny22345,$0.18-0.45,Min. order: 50 pieces
https://s.alicdn.com/@sc04/kf/H5b8d7d564e5440e082df1c3be2a7b3d07.png_300x300.png,https://img.alicdn.com/imgextra/i3/3028865584/O1CN01micZy61r7WfFIOiJy_!!3028865584.jpg,C-PIN Elastic safety lanyard Anti-fall Adjustable Safety Lanyard With Carabiner tool lanyard carabiner,/contact us by Wechatname:Sunny22345,$0.70-1.50,Min. order: 50 pieces
https://s.alicdn.com/@sc04/kf/H337684f7d7034451abe6018e86f036dcR.jpg_300x300.jpg,https://img.alicdn.com/imgextra/i3/3028865584/O1CN01micZy61r7WfFIOiJy_!!3028865584.jpg,Custom Polyester Retractable Tool Safety Lanyards With Double Carabiner Working At Height,/contact us by Wechatname:Sunny22345,$1.90-2.50,Min. order: 50 pieces
https://s.alicdn.com/@sc04/kf/Hbbcf67b2915a439f92d578294844dd7dN.jpg_300x300.jpg,https://img.alicdn.com/imgextra/i3/3028865584/O1CN01micZy61r7WfFIOiJy_!!3028865584.jpg,Universal Crossbody Necklace Cell Mobile Smartphone Patch Tab Lasso Tether Strap Phone Lanyard Luminous Mobile Phone Lanyard,/contact us by Wechatname:Sunny22345,,Min. order: 50 pieces
https://s.alicdn.com/@sc04/kf/Hd998c6b63ef34a99b7709826179d88bec.png_300x300.png,https://img.alicdn.com/imgextra/i3/3028865584/O1CN01micZy61r7WfFIOiJy_!!3028865584.jpg,C-PIN black steel carabiner Aloft work high quality lanyard Tool leash Bungee Cord nylon bungee rope tether tools Safety Lanyard,/contact us by Wechatname:Sunny22345,,Min. order: 50 pieces
https://s.alicdn.com/@sc04/kf/H3847452bcf9f4aafa8c9ccef22d22b4bI.jpg_300x300.jpg,https://img.alicdn.com/imgextra/i3/3028865584/O1CN01micZy61r7WfFIOiJy_!!3028865584.jpg,Customized Logo Design Promotional Business Staff Lanyard with Custom Company Logo Pen Bottle Lanyard Holder,/contact us by Wechatname:Sunny22345,,Min. order: 50 pieces
https://s.alicdn.com/@sc04/kf/Hec8c8cab816f48e98a741f901997f782S.jpg_300x300.jpg,https://img.alicdn.com/imgextra/i3/3028865584/O1CN01micZy61r7WfFIOiJy_!!3028865584.jpg,Rainbow lanyard Gay Pride LGBT Party Lesbian Neck Lanyard with Safety Buckle,/contact us by Wechatname:Sunny22345,,Min. order: 50 pieces
https://s.alicdn.com/@sc04/kf/H7af14b1e0542427a9234b88e3f8c4290Y.jpg_300x300.jpg,https://img.alicdn.com/imgextra/i3/3028865584/O1CN01micZy61r7WfFIOiJy_!!3028865584.jpg,Wholesale Custom Nylon Polyester Print Keychain Neck Strap Medal Sublimated Card Holder Lanyard With Logo Custom,/contact us by Wechatname:Sunny22345,$0.15-0.31,Min. order: 50 pieces
https://s.alicdn.com/@sc04/kf/H0df06c5858084a88a5511f4928e50180a.jpg_300x300.jpg,https://img.alicdn.com/imgextra/i3/3028865584/O1CN01micZy61r7WfFIOiJy_!!3028865584.jpg,Flat Polyester Cheap Personalize Single Custom Lanyards Pet Collar Dog Leashing Rope Chest Vest Strap Set,/contact us by Wechatname:Sunny22345,$1.00-2.70,Min. order: 50 pieces
https://s.alicdn.com/@sc04/kf/Hc99d38c10ec7424797cccfbadb28d80ds.jpg_300x300.jpg,https://img.alicdn.com/imgextra/i3/3028865584/O1CN01micZy61r7WfFIOiJy_!!3028865584.jpg,High quality personalized blank id neck strap custom logo silk screen printed polyester airline airbus air lanyard for staffs,/contact us by Wechatname:Sunny22345,$0.11-0.35,Min. order: 50 pieces
https://s.alicdn.com/@sc04/kf/H7f390d3236394f3fab623794457a53eaU.jpg_300x300.jpg,https://img.alicdn.com/imgextra/i3/3028865584/O1CN01micZy61r7WfFIOiJy_!!3028865584.jpg,"Metal Ring Buckle, Mobile Phone Lanyard, Short, Multifunctional, Personalized And Creative Pendant, Internet Red Support Bracket",/contact us by Wechatname:Sunny22345,$0.90-1.21,Min. order: 50 pieces
https://s.alicdn.com/@sc04/kf/H8743a057dd114b6aad4a52ba1f09739bQ.jpg_300x300.jpg,https://img.alicdn.com/imgextra/i3/3028865584/O1CN01micZy61r7WfFIOiJy_!!3028865584.jpg,Custom Embroidered Car Logo Lanyard Woven Key Chains llavero/Embroidered Fabric Keyring Keychain,/contact us by Wechatname:Sunny22345,$0.39-0.89,Min. order: 50 pieces
https://s.alicdn.com/@sc04/kf/H2c451b0d93a84f5fb9a48360a29cca11S.png_300x300.png,https://img.alicdn.com/imgextra/i3/3028865584/O1CN01micZy61r7WfFIOiJy_!!3028865584.jpg,Adjustable Keychain Lanyard Portable Polyester Wrist Hand Lanyard,/contact us by Wechatname:Sunny22345,,Min. order: 50 pieces
https://s.alicdn.com/@sc04/kf/Hfa7cbafd60ed4989a0ebab24b7eda832K.jpg_300x300.jpg,https://img.alicdn.com/imgextra/i3/3028865584/O1CN01micZy61r7WfFIOiJy_!!3028865584.jpg,Heavy Duty Nylon Safety Tool Lanyard Flexible Tool Holder Lanyard With Your Logo Free Sample Making,/contact us by Wechatname:Sunny22345,,Min. order: 50 pieces
https://s.alicdn.com/@sc04/kf/Hb807f37df6924679981bc97def3509a8j.jpg_300x300.jpg,https://img.alicdn.com/imgextra/i3/3028865584/O1CN01micZy61r7WfFIOiJy_!!3028865584.jpg,Lanyard Manufacturer Promotional Cheap Custom Printed Polyester Neck Lanyard With Logo and Easy Pull Clasp,/contact us by Wechatname:Sunny22345,,Min. order: 50 pieces
https://s.alicdn.com/@sc04/kf/H170971dc173c4f55901f5a121e5dafa4j.jpg_300x300.jpg,https://img.alicdn.com/imgextra/i3/3028865584/O1CN01micZy61r7WfFIOiJy_!!3028865584.jpg,Round Glasses Lanyard Swimming Sunglasses Strap Cord Nylon Material Straps Glasses Wholesale Eyeglasses Holder,/contact us by Wechatname:Sunny22345,$0.29-0.39,Min. order: 50 pieces
https://s.alicdn.com/@sc04/kf/He105f81e39cf4a5e8daac0adf1ab8cfdw.jpg_300x300.jpg,https://img.alicdn.com/imgextra/i3/3028865584/O1CN01micZy61r7WfFIOiJy_!!3028865584.jpg,Manufacturer Cheap Personalized Neck Tool Printing Polyester Sublimation Custom keychain Lanyards With Logo,/contact us by Wechatname:Sunny22345,$0.69-1.29,Min. order: 50 pieces
https://s.alicdn.com/@sc04/kf/Hd143a5d8bea34d929e592c101db9eb1fs.jpg_300x300.jpg,https://img.alicdn.com/imgextra/i3/3028865584/O1CN01micZy61r7WfFIOiJy_!!3028865584.jpg,Wholesale Adjustable shoulder Straps Kids Nylon Lanyard for Chinese New Year Red Envelope Chinese lucky red pouch,/contact us by Wechatname:Sunny22345,$0.30-0.35,Min. order: 50 pieces
https://s.alicdn.com/@sc04/kf/H768240c928d04e44b734395f3193c69fr.jpg_300x300.jpg,https://img.alicdn.com/imgextra/i3/3028865584/O1CN01micZy61r7WfFIOiJy_!!3028865584.jpg,Custom Green NYLON Neck Strap Lanyard with safety clip and plastic clip,/contact us by Wechatname:Sunny22345,$0.19-0.29,Min. order: 50 pieces
https://s.alicdn.com/@sc04/kf/H238db581a1424129b6b6e188dc5528144.jpg_300x300.jpg,https://img.alicdn.com/imgextra/i3/3028865584/O1CN01micZy61r7WfFIOiJy_!!3028865584.jpg,New hot sale heat transfer pattern unisex hanging work permit mobile phone long lanyard for keys,/contact us by Wechatname:Sunny22345,$1.67,Min. order: 50 pieces
https://s.alicdn.com/@sc04/kf/H723305b6292e4e64aadc8cc612c3271af.jpg_300x300.jpg,https://img.alicdn.com/imgextra/i3/3028865584/O1CN01micZy61r7WfFIOiJy_!!3028865584.jpg,Beaded lanyard for keys Boho flowers wood bead trendy necklace badge teacher life lanyards school withs tyle for women gift,/contact us by Wechatname:Sunny22345,,Min. order: 50 pieces
https://s.alicdn.com/@sc04/kf/H96f8fbddd6ac4e7181bb5c0a615c8529Z.jpg_300x300.jpg,https://img.alicdn.com/imgextra/i3/3028865584/O1CN01micZy61r7WfFIOiJy_!!3028865584.jpg,Colorful Nylon Keychain Lanyard Accessories Hand Wristlet Key Chain Holder Lanyards With logo Custom,/contact us by Wechatname:Sunny22345,,Min. order: 50 pieces
https://s.alicdn.com/@sc04/kf/H240ac1e958894ee0a66cd07abb3eaa0eJ.jpg_300x300.jpg,https://img.alicdn.com/imgextra/i3/3028865584/O1CN01micZy61r7WfFIOiJy_!!3028865584.jpg,High Quality Pen Holder Lace Neck Woven Custom Lanyard Rubber Band Jacquard Webbing Silicone Ring Rope Lanyard,/contact us by Wechatname:Sunny22345,,Min. order: 50 pieces
https://s.alicdn.com/@sc04/kf/H1153f234cf3f416e8e6b1c74286a7a45r.jpg_300x300.jpg,https://img.alicdn.com/imgextra/i3/3028865584/O1CN01micZy61r7WfFIOiJy_!!3028865584.jpg,New design Nylon Safety Tool Lanyards for Scaffolders Fall Protection Tool Lanyards tool coiled lanyard,/contact us by Wechatname:Sunny22345,$0.98-1.45,Min. order: 50 pieces
https://s.alicdn.com/@sc04/kf/Heaa0ba38256143018081dbff2a41031c7.jpg_300x300.jpg,https://img.alicdn.com/imgextra/i3/3028865584/O1CN01micZy61r7WfFIOiJy_!!3028865584.jpg,Boho Style Teacher's Day Gift Keychain Rainbow Silicone Beads Wooden Beads Nylon Lanyard,/contact us by Wechatname:Sunny22345,$0.98-1.56,Min. order: 50 pieces
https://s.alicdn.com/@sc04/kf/He16b53670cc94c9a8d6695818176b071l.jpg_300x300.jpg,https://img.alicdn.com/imgextra/i3/3028865584/O1CN01micZy61r7WfFIOiJy_!!3028865584.jpg,No Minimum Cheap Custom Multicolor Metal Hook Lanyard Printed Lanyards With Logo Custom,/contact us by Wechatname:Sunny22345,,Min. order: 50 pieces
https://s.alicdn.com/@sc04/kf/He64b11621d6e42a69efb9174658e93b1M.jpg_300x300.jpg,https://img.alicdn.com/imgextra/i3/3028865584/O1CN01micZy61r7WfFIOiJy_!!3028865584.jpg,Custom Mobile Phone Rope Short Lanyard Jewelry Hanging Rope Hand-woven Rope Jewelry Small Lanyard Toy 8 Character Lanyard,/contact us by Wechatname:Sunny22345,$0.01-0.09,Min. order: 50 pieces
https://s.alicdn.com/@sc04/kf/H9a792600d2ae4aaca441f367815ac835I.jpg_300x300.jpg,https://img.alicdn.com/imgextra/i3/3028865584/O1CN01micZy61r7WfFIOiJy_!!3028865584.jpg,Polyester ID card cover Lanyard Wholesale Neck Lanyard Strap Breakaway Custom Silkscreen Printing Logo Polyester Airbus Lanyards,/contact us by Wechatname:Sunny22345,$0.18-0.48,Min. order: 50 pieces
https://s.alicdn.com/@sc04/kf/H2c1d62b9da21423682e59114f4564fe6Z.jpg_300x300.jpg,https://img.alicdn.com/imgextra/i3/3028865584/O1CN01micZy61r7WfFIOiJy_!!3028865584.jpg,Dia 6 MM 5KN 5 10 20 30 Meters Core-spun Parachute Cord Lanyard Tent Rope For Hiking Camping Clothesline,/contact us by Wechatname:Sunny22345,$0.03-0.14,Min. order: 50 pieces
https://s.alicdn.com/@sc04/kf/H6a54fb30d77345ee806f4d76c0ca2e9bU.jpg_300x300.jpg,https://img.alicdn.com/imgextra/i3/3028865584/O1CN01micZy61r7WfFIOiJy_!!3028865584.jpg,Wholesale Phone Printed Lanyard Design Custom Nylon Lanyards Keychain Polyester Lanyards With Logo Custom,/contact us by Wechatname:Sunny22345,$0.20-0.28,Min. order: 50 pieces
https://s.alicdn.com/@sc04/kf/H94c365e1ee46456aa71dbb38eac0fe88Y.jpg_300x300.jpg,https://img.alicdn.com/imgextra/i3/3028865584/O1CN01micZy61r7WfFIOiJy_!!3028865584.jpg,Hot Sale Crossbody Nylon Patch Phone Lanyard Hanging Neck Shoulder Nylon Strap Universal Adjustable Mobile Phone Lanyard,/contact us by Wechatname:Sunny22345,,Min. order: 50 pieces
https://s.alicdn.com/@sc04/kf/Hf1321420c8d34caca5795bf32567b4b1g.jpg_300x300.jpg,https://img.alicdn.com/imgextra/i3/3028865584/O1CN01micZy61r7WfFIOiJy_!!3028865584.jpg,Blank Sublimation Polyester Nylon Plain Cheap Personalized Custom Logo Printed Lanyard Wholesale,/contact us by Wechatname:Sunny22345,$0.14,Min. order: 50 pieces
https://s.alicdn.com/@sc04/kf/He5492fafd18f401f87901ad337d9f7daf.jpg_300x300.jpg,https://img.alicdn.com/imgextra/i3/3028865584/O1CN01micZy61r7WfFIOiJy_!!3028865584.jpg,High Quality Lanyards With logo love Custom pink Keychain pink Keychain Lanyard,/contact us by Wechatname:Sunny22345,,Min. order: 50 pieces
https://s.alicdn.com/@sc04/kf/Hde97b898d13140f9ad43c48094f38df1W.jpg_300x300.jpg,https://img.alicdn.com/imgextra/i3/3028865584/O1CN01micZy61r7WfFIOiJy_!!3028865584.jpg,Promotional Custom Printable Plain Ribbon Roll White Blank Thick Polyester Strap Webbing For Lanyard,/contact us by Wechatname:Sunny22345,$0.05-0.28,Min. order: 50 pieces
https://s.alicdn.com/@sc04/kf/H649f02f1af174a24aa85fcb15c5903c0Q.jpg_300x300.jpg,https://img.alicdn.com/imgextra/i3/3028865584/O1CN01micZy61r7WfFIOiJy_!!3028865584.jpg,Polyester Lanyards Full Color Printing Neck Straps Personalized Custom Logo Printed Lanyard,/contact us by Wechatname:Sunny22345,,Min. order: 50 pieces
https://s.alicdn.com/@sc04/kf/H87aa193bb8d64b6686e32e67e1ad8873t.jpg_300x300.jpg,https://img.alicdn.com/imgextra/i3/3028865584/O1CN01micZy61r7WfFIOiJy_!!3028865584.jpg,Adjustable Custom Round Woven Braided Cotton Wrist Strap Lanyard For Water Bottle Mini Fan Speaker Cell Phone Camera,/contact us by Wechatname:Sunny22345,$0.08-0.28,Min. order: 50 pieces
https://s.alicdn.com/@sc04/kf/H8503cccb18ba446ca7427de5353056bdU.jpg_300x300.jpg,https://img.alicdn.com/imgextra/i3/3028865584/O1CN01micZy61r7WfFIOiJy_!!3028865584.jpg,Custom made your own logo design silicone rubber zipper puller for clothes bag wholesale nylon zip pull lanyard,/contact us by Wechatname:Sunny22345,$0.15,Min. order: 50 pieces
https://s.alicdn.com/@sc04/kf/H854886665bfd47858801bbd22aacd4831.jpg_300x300.jpg,https://img.alicdn.com/imgextra/i3/3028865584/O1CN01micZy61r7WfFIOiJy_!!3028865584.jpg,Universal Waterproof Cell Phone Lanyard Wrist Lanyard with Patch Adjustable Neck Wrist Straps for Phone Case,/contact us by Wechatname:Sunny22345,,Min. order: 50 pieces
https://s.alicdn.com/@sc04/kf/Hb7ba17f6f9d8460dbcbab76208cc77cbb.jpg_300x300.jpg,https://img.alicdn.com/imgextra/i3/3028865584/O1CN01micZy61r7WfFIOiJy_!!3028865584.jpg,Factory Price 2 in 1 Phone Strap 40cm Detachable Nylon Rope for MP3 ID Card U Disk Neck Lanyard Finger Mobile Phone Chest Strap,/contact us by Wechatname:Sunny22345,$0.05-0.12,Min. order: 50 pieces
https://s.alicdn.com/@sc04/kf/H3375e0a40c6b481cba52ab798b64c334i.jpg_300x300.jpg,https://img.alicdn.com/imgextra/i3/3028865584/O1CN01micZy61r7WfFIOiJy_!!3028865584.jpg,competitive price black ladder adjustable plastic safety break for lanyard,/contact us by Wechatname:Sunny22345,$0.04-0.05,Min. order: 50 pieces
https://s.alicdn.com/@sc04/kf/Ha1cef7ad1b334803b65b169638a14edcM.jpg_300x300.jpg,https://img.alicdn.com/imgextra/i3/3028865584/O1CN01micZy61r7WfFIOiJy_!!3028865584.jpg,Factory Direct Price Stain Ribbon Red Lanyard Custom Phone Lanyards Thermal Transfer Short Wristband Printed Key Lanyard,/contact us by Wechatname:Sunny22345,$0.18-0.60,Min. order: 50 pieces
https://s.alicdn.com/@sc04/kf/H3ff8e6246b3d48cf87c4f4af0a6a5734f.jpg_300x300.jpg,https://img.alicdn.com/imgextra/i3/3028865584/O1CN01micZy61r7WfFIOiJy_!!3028865584.jpg,Promotional Wholesale Multi Color Keychain Polyester Printed Neck Strap Lanyards Custom Logo Dragon Ball Lanyards,/contact us by Wechatname:Sunny22345,,Min. order: 50 pieces
https://s.alicdn.com/@sc04/kf/Hb375f41c05b5426b9b2522d1af801e55a.jpg_300x300.jpg,https://img.alicdn.com/imgextra/i3/3028865584/O1CN01micZy61r7WfFIOiJy_!!3028865584.jpg,"high quality Retractable Custom Printed Lanyard, Customized Polyester Lanyard Keychain Nylon Lanyard",/contact us by Wechatname:Sunny22345,$0.15-0.20,Min. order: 50 pieces
https://s.alicdn.com/@sc04/kf/H7b61ad110a83496d822ce2a129d29eb7J.jpg_300x300.jpg,https://img.alicdn.com/imgextra/i3/3028865584/O1CN01micZy61r7WfFIOiJy_!!3028865584.jpg,Polyester NYLON cordon silicon botella tour de cou badge retractable blank lanyard and lanyard ID card holder with printing logo,/contact us by Wechatname:Sunny22345,,Min. order: 50 pieces
https://s.alicdn.com/@sc04/kf/U8ba4e892fb6c4c51b324040c811edb26g.jpg_300x300.jpg,https://img.alicdn.com/imgextra/i3/3028865584/O1CN01micZy61r7WfFIOiJy_!!3028865584.jpg,NO MOQ Polyester Lanyards Metal Accessories For Lanyards,/contact us by Wechatname:Sunny22345,,Min. order: 50 pieces
https://s.alicdn.com/@sc04/kf/Hab3650297e754f79aaffd8a4d64abb662.jpg_300x300.jpg,https://img.alicdn.com/imgextra/i3/3028865584/O1CN01micZy61r7WfFIOiJy_!!3028865584.jpg,Custom Sublimation Printed Custom Short Lanyard Strap Carabiner Keychain Mini Designer Keychain Lanyard For Promotion,/contact us by Wechatname:Sunny22345,,Min. order: 50 pieces
https://s.alicdn.com/@sc04/kf/H8ad76c8be95f4375a82b23a79890d0b1q.jpg_300x300.jpg,https://img.alicdn.com/imgextra/i3/3028865584/O1CN01micZy61r7WfFIOiJy_!!3028865584.jpg,Black Lobster Clasp Lanyard Strap Cord Mobile Straps Charm Nylon Key Ring Chain DIY Jewelry 100pcs/bag Artificial Lanyard/strap,/contact us by Wechatname:Sunny22345,,Min. order: 50 pieces
https://s.alicdn.com/@sc04/kf/Hdec7f1e9858e45db935ef0271d774101r.jpg_300x300.jpg,https://img.alicdn.com/imgextra/i3/3028865584/O1CN01micZy61r7WfFIOiJy_!!3028865584.jpg,Bling star Wholesale Multi Style Rhinestone Retractable id badge card holder with lanyard,/contact us by Wechatname:Sunny22345,$0.87-1.00,Min. order: 50 pieces
https://s.alicdn.com/@sc04/kf/Hbb0c41e416ed4db8ac898c4b853e1dffb.jpg_300x300.jpg,https://img.alicdn.com/imgextra/i3/3028865584/O1CN01micZy61r7WfFIOiJy_!!3028865584.jpg,wholesale NO MOQ office usage custom lanyard Safety anime cartoon printing tool lanyards with logo custom phone lanyard,/contact us by Wechatname:Sunny22345,$0.14-0.20,Min. order: 50 pieces
